id,system,bodyName
2982,2168,OMEGA SECTOR LC-V C2-75 B 2
2983,2169,OMEGA SECTOR LH-V B2-4 1
2984,2170,OMEGA SECTOR MI-S B4-3 2
2985,2171,OMEGA SECTOR NX-U C2-39 4 D
2986,2172,OMEGA SECTOR OI-T C3-16 1
2987,2173,OMEGA SECTOR OS-T B3-14 2
2988,2174,OMEGA SECTOR PD-S B4-14 3
2989,2175,OMEGA SECTOR PD-S B4-7 1
2990,2176,OMEGA SECTOR PY-R B4-1 A 1 C
2991,2176,OMEGA SECTOR PY-R B4-1 C 1
2992,2176,OMEGA SECTOR PY-R B4-1 C 2
2993,2176,OMEGA SECTOR PY-R B4-1 C 3
2994,2177,OMEGA SECTOR RD-T C3-31 C 1
2995,2178,OMEGA SECTOR UJ-Q B5-4 B 1
2996,2179,OMEGA SECTOR VE-Q B5-15 2
2997,2179,OMEGA SECTOR VE-Q B5-15 6 G
2998,2179,OMEGA SECTOR VE-Q B5-15 6 I
2999,2179,OMEGA SECTOR VE-Q B5-15 7 B
3000,2180,OMEGA SECTOR VJ-Q B5-6 CD 1
3001,2180,OMEGA SECTOR VJ-Q B5-6 CD 4 A
3002,2181,OMEGA SECTOR WP-O B6-2 A 4
3003,2182,OMEGA SECTOR WW-H A11-0 6 A
3004,2183,OMEGA SECTOR YK-O B6-9 4 A
3005,2184,ONGAIHN EC-D D12-473 B 4
3006,2184,ONGAIHN EC-D D12-473 B 6 A
3007,2185,ONGAIHN IO-Z D13-7146 3 B A
3008,2186,ONGAIHN WX-S B58-145 A 1 B
3009,2187,OOCHORRS CW-N D6-0 C 4 B
3010,2188,OOCHORRS CY-G B2-0 A 1 E
3011,2189,OOCHORRS FO-C C15-0 CDEF 7 A
3012,2190,OOCHORRS HX-B C16-0 CD 1 C
3013,2191,OOCHORRS JA-I C12-1 B 10 B
3014,2192,OOCHORRS KF-D D13-5 3 A
3015,2193,OOCHORRS MU-M D8-14 B 9 B
3016,2194,OOCHORRS NF-L D9-12 B 4 B
3017,2195,OOCHORRS SY-Z C16-2 B 12 A
3018,2196,OOCHOST AH-J D10-4 C 5 A
3019,2197,OOCHOST AO-C B19-0 2
3020,2197,OOCHOST AO-C B19-0 3
3021,2197,OOCHOST AO-C B19-0 5 A
3022,2198,OOCHOST BH-J D10-0 B 1 E
3023,2198,OOCHOST BH-J D10-0 B 2 C
3024,2199,OOCHOST BY-B C16-1 2 A
3025,2200,OOCHOST IZ-R C20-0 B 4 C
3026,2201,OOCHOST JN-O C21-0 D 1 B
3027,2201,OOCHOST JN-O C21-0 D 3 A
3028,2202,OOCHOST NO-N B54-1 1
3029,2203,OOCHOST VT-Z D13-0 ABC 1
3030,2204,OOCHOXT EM-G B16-0 A 3 C
3031,2205,OOCHOXT PI-N B12-0 3 A
3032,2206,OOCHOXT WQ-T D4-3 1 B
3033,2207,OOTOFF MJ-X C2-2 A 2 A
3034,2208,ORION DARK REGION CL-Y D15 2
3035,2209,ORION DARK REGION EG-Y D6 A 4
3036,2210,ORION DARK REGION FG-Y D11 A 5 A
3037,2211,ORION SECTOR ZE-A D15 B 6
3038,2212,OUTOPPS EB-N D7-1 AB 1
3039,2212,OUTOPPS EB-N D7-1 B 2
3040,2212,OUTOPPS EB-N D7-1 B 3
3041,2212,OUTOPPS EB-N D7-1 B 6 A
3042,2212,OUTOPPS EB-N D7-1 B 7 A
3043,2213,OUTOPPS ED-G B38-0 A 5 A
3044,2214,OUTOPPS JN-P C20-0 3 A
3045,2215,OUTOPPS KH-L D8-2 7 A
3046,2215,OUTOPPS KH-L D8-2 7 B
3047,2216,OUTOPPS KS-S C17-1 A 1
3048,2217,OUTOPPS ML-S C18-0 B 2 A
3049,2218,OUTOPPS PX-S C17-1 B 2 E A
3050,2219,OUTOPPS RQ-L C21-0 B 10 A
3051,2220,OUTOPPS VJ-I D9-6 BC 2 F
3052,2221,OUTORDY JB-O D6-4 AB 1
3053,2222,OUTORDY MB-V C16-1 6 A
3054,2223,OUTORDY VD-V B57-0 1 A
3055,2224,OUTORDY ZD-Q C19-0 A 3 B
3056,2225,OUTORST CV-W B57-0 12 A
3057,2226,OUTORST DF-C C27-1 4 C
3058,2227,OUTORST DF-L C22-0 1
3059,2228,OUTORST EN-R C18-1 B 1
3060,2229,OUTORST GQ-G D10-28 A 3 A
3061,2230,OUTORST GY-R B46-0 2 A
3062,2230,OUTORST GY-R B46-0 2 B
3063,2230,OUTORST GY-R B46-0 3 B
3064,2231,OUTORST IL-A C28-1 2 A
3065,2232,OUTORST MB-F C11-0 4 A
3066,2233,OUTORST PE-H C10-0 7 F
3067,2234,OUTORST SB-J B23-0 AB 7 B
3068,2235,OUTORST VW-I C23-1 1
3069,2236,OUTOTCH NA-H B10-0 2
3070,2237,OUTOTZ AS-F B39-0 A 3
3071,2238,OUTOTZ BB-V C16-0 ABC 2 B A
3072,2239,OUTOTZ CI-R C18-0 B 6 B
3073,2240,OUTOTZ EH-T C17-1 B 2
3074,2241,OUTOTZ FU-D C13-0 A 1 A
3075,2242,OUTOTZ HD-J D9-3 B 11 D
3076,2242,OUTOTZ HD-J D9-3 B 8 D
3077,2243,OUTOTZ HS-J D9-2 B 7 C
3078,2244,OUTOTZ IT-Z C13-2 B 9 B
3079,2245,OUTOTZ JD-I C10-0 C 10 A
3080,2245,OUTOTZ JD-I C10-0 C 9 A
3081,2245,OUTOTZ JD-I C10-0 C 9 E A
3082,2246,OUTOTZ KD-K D8-13 BC 7 A
3083,2246,OUTOTZ KD-K D8-13 BC 7 D A
3084,2247,OUTOTZ LS-K D8-3 B 5 A
3085,2247,OUTOTZ LS-K D8-3 B 5 C
3086,2247,OUTOTZ LS-K D8-3 B 7 B
3087,2248,OUTOTZ LZ-O C19-4 C 4 B
3088,2249,OUTOTZ ND-J D9-5 B 3 B
3089,2250,OUTOTZ PI-K D8-0 BC 2 A
3090,2250,OUTOTZ PI-K D8-0 BC 3 A
3091,2251,OUTOTZ PT-Q D5-0 1 E
3092,2251,OUTOTZ PT-Q D5-0 5 B
3093,2252,OUTOTZ XV-I B37-0 C 2
3094,2253,P CARINAE 2
3095,2254,P VELORUM 3 A
3096,2255,PALLAENI A 1
3097,2255,PALLAENI A 2
3098,2256,PARENAGO 2149 B 2 D
3099,2257,PARROT'S HEAD SECTOR FB-X C1-7 A 1
3100,2258,PARROT'S HEAD SECTOR IH-V C2-20 1
3101,2258,PARROT'S HEAD SECTOR IH-V C2-20 2
3102,2258,PARROT'S HEAD SECTOR IH-V C2-20 3
3103,2259,PARROT'S HEAD SECTOR ND-R B5-4 1
3104,2260,PCYC 275 B 2 C
3105,2260,PCYC 275 B 3 C
3106,2261,PEGASI SECTOR FR-M B7-2 A 1
3107,2262,PENCIL SECTOR DL-Y D51 A 2
3108,2263,PENCIL SECTOR DQ-Y C22 12 D A
3109,2264,PENCIL SECTOR EL-Y D5 A 2 A
3110,2265,PENCIL SECTOR IR-W D1-144 8 A A
3111,2266,PENCIL SECTOR JM-V B2-13 AB 2 A
3112,2267,PENCIL SECTOR JM-W D1-97 1 A
3113,2268,PENCIL SECTOR JR-W C1-4 1
3114,2268,PENCIL SECTOR JR-W C1-4 2
3115,2269,PENCIL SECTOR LR-W C1-16 A 3 A
3116,2269,PENCIL SECTOR LR-W C1-16 A 4 A
3117,2270,PENCIL SECTOR OC-U A3-2 A 2 A
3118,2271,PENCIL SECTOR ZU-P B5-0 1
3119,2271,PENCIL SECTOR ZU-P B5-0 4
3120,2272,PERSEUS DARK REGION YL-L B8-0 B 2
3121,2272,PERSEUS DARK REGION YL-L B8-0 C 4
3122,2273,PHA FLAAE II-J D9-175 A 1 C A
3123,2274,PHA FLEAU ND-K D8-81 6 A
3124,2275,PHA FLEE OO-O D7-59 ABCD 2 A
3125,2276,PHA FLEE PO-O D7-6 3 B
3126,2276,PHA FLEE PO-O D7-6 5 A
3127,2277,PHA PHLAI DN-Y B0 B 2 A
3128,2278,PHAA AIN BZ-Q C18-3 3 A
3129,2279,PHAA AOC BW-V E2-3309 E 1 A
3130,2279,PHAA AOC BW-V E2-3309 F 1
3131,2279,PHAA AOC BW-V E2-3309 F 2
3132,2279,PHAA AOC BW-V E2-3309 F 3
3133,2280,PHAA AOC UC-N C9-278 3 F
3134,2281,PHAA BRIAE PU-E D12-249 A 3 D
3135,2282,PHEIA BRIAE EL-Q C20-148 B 1 B A
3136,2282,PHEIA BRIAE EL-Q C20-148 B 2 A
3137,2283,PHI ANDROMEDAE A 3
3138,2284,PHIPOEA BG-O E6-2320 A 1
3139,2285,PHIPOEA CI-U C3-48 2 C
3140,2286,PHIPOEA HJ-D C27-5254 3 A
3141,2287,PHIPOEA JW-V D2-4030 2
3142,2288,PHIPOEA OI-B E6117 1 A
3143,2289,PHIPOEA TQ-G B26-61 3 C
3144,2289,PHIPOEA TQ-G B26-61 3 D
3145,2290,PHIPOEA TZ-F D11-5496 2 B
3146,2291,PHIPOEA WK-E D12-1374 4 B
3147,2292,PHLEEDGAA ZP-O E6-3934 BCD 9 A
3148,2293,PHOO AIL QG-Y D4 2
3149,2294,PHOO AIL XC-Z C27-5 4 B
3150,2295,PHOO AIL XS-U D2-3 B 6 A
3151,2296,PHOOE FLAAE GG-O C6-6 B 10 B
3152,2297,PHRAA BLOO LX-U D2-16 A 6 A
3153,2298,PHRAA BLOO LX-U D2-2 6 F A
3154,2299,PHRAA BYOE CY-A B58-10 A 2
3155,2300,PHRAA BYOE NY-B C28-347 F 6
3156,2301,PHRAA BYOE SB-B D14-1833 B 6 A
3157,2302,PHRAA EAEC HT-O D7-76 1
3158,2302,PHRAA EAEC HT-O D7-76 2
3159,2302,PHRAA EAEC HT-O D7-76 3
3160,2302,PHRAA EAEC HT-O D7-76 4
3161,2303,PHRAA EAEC XJ-X D2-32 A 3 A
3162,2304,PHRAA FLYOO FR-T D4-3883 ABC 1
3163,2305,PHRAUTCH KS-R D5-41 B 1
3164,2306,PHROEA EAEC BL-O D6-3 6 C A
3165,2307,PHROEA HYPA ZC-Y B48-0 A 2 A
3166,2308,PHROEA HYPAI BQ-E C28-4 EF 1 B
3167,2309,PHROEA HYPAI HT-F D12-21 BC 7 A
3168,2310,PHROEA HYPAI IU-R C7-8 3 B A
3169,2311,PHROEA HYPAI KG-F C14-16 5 C A
3170,2312,PHROEA HYPAI KG-N C23-6 B 1 A
3171,2313,PHROEA HYPAI KR-C D18 B 3 A
3172,2314,PHROEA HYPAI RD-Z D1-13 B 2 A
3173,2315,PHROEA HYPAI ZP-V D3-40 B 12 A
3174,2316,PHROEA PRAO TI-J C25-650 B 3 A
3175,2317,PHROI BLUAE AM-C D13-3648 A 8 A
3176,2318,PHROI BLUAE CX-A D14-2758 2
3177,2319,PHROI BLUAE EH-C D13-559 1
3178,2320,PHROI BLUAE GC-B D14-990 8 D
3179,2321,PHROI BLUAE GR-M D7-2680 A 2
3180,2322,PHROI BLUAE GY-O C20-171 A 1
3181,2323,PHROI BLUAE IR-W F1-1530 AB 1
3182,2324,PHROI BLUAE IR-W F1-1666 B 14 A
3183,2325,PHROI BLUAE JG-W D2-460 1 A
3184,2326,PHROI BLUAE KX-K D8-371 4 B
3185,2327,PHROI BLUAE OJ-H D10-1661 ABC 1 C
3186,2327,PHROI BLUAE OJ-H D10-1661 ABC 1 D
3187,2328,PHROI BLUAE QI-T E3-0 2
3188,2329,PHROI BLUAE QI-T E3-3454 3 A
3189,2330,PHROI BYOE LK-X C2-345 C 1
3190,2331,PHROI BYOE NT-Q E5-3353 A 9
3191,2332,PHROI BYOE WF-D D13-864 3 B
3192,2333,PHROI BYOE XX-U D2-429 A 1
3193,2334,PHROI FLYUAE FN-E C14-2586 5 C
3194,2335,PHROI FLYUAE YP-M D8-3622 2 A
3195,2336,PHROI PHOE UB-W C18-8 B 1
3196,2337,PHROI PRI LC-B D1-6200 AB 7 C A
3197,2338,PHROI PRI MH-P C8-6420 C 1 A
3198,2339,PHROI PRI QX-A D1-7940 A 1 C A
3199,2340,PHROI PRUAE JC-V E2-4262 2
3200,2341,PHUA AIHM FF-A D67 A 5 A
3201,2342,PHUA AIHM PA-A D74 C 1 A
3202,2342,PHUA AIHM PA-A D74 CD 7 C
3203,2343,PHUA AUB BN-D C12-4871 A 2 A
3204,2344,PHUA AUB DC-R C19-5000 AB 1 A
3205,2345,PHUA AUB FS-N C6-2864 4 A
3206,2346,PHUA AUB FV-W D2-2756 4
3207,2347,PHUA AUB GZ-D D13-1159 1
3208,2348,PHUA AUB OX-A C27-6864 2
3209,2349,PHUA AUB PA-A D1339 3 B
3210,2350,PHUA AUB SJ-R E4-8234 1 D
3211,2351,PHUA AUB YE-A C29-2031 3 A
3212,2352,PHUA AUB ZQ-P C5-605 1 C
3213,2352,PHUA AUB ZQ-P C5-605 1 D
3214,2353,PHUA AUDST DK-I D9-141 A 1
3215,2354,PHUA AUDST ER-N E6-4644 A 2
3216,2355,PHYLUWYG XL-W C2-4 6 C
3217,2356,PLAA AESCS FA-H B10-6 A 6 A
3218,2356,PLAA AESCS FA-H B10-6 A 6 B
3219,2357,PLAA AESCS FQ-Y D121 1
3220,2358,PLAA AESCS HG-Y D218 A 1
3221,2359,PLAA AESCS IC-X B1-7 B 2
3222,2360,PLAA AESCS KR-N C6-76 B 1
3223,2361,PLAA AESCS MA-P B47-11 2 B
3224,2362,PLAA AESCS NL-Y C16 2
3225,2363,PLAA AESCS QW-W C1-20 A 1 A
3226,2364,PLAA AESCS SL-Y C11 1
3227,2365,PLAA AESCS SS-U C2-74 A 2 A
3228,2366,PLAA AESCS TC-V C2-11 A 1 A
3229,2367,PLAA AESCS TL-Y C10 1
3230,2368,PLAA AESCS WJ-L B35-13 1 A
3231,2369,PLAA AESCS YD-S B4-2 3 A
3232,2370,PLAA AIN GG-I B37-13 6 F
3233,2371,PLAA AIN HE-A C1-0 1 C
3234,2372,PLAA EURK MJ-G C24-13 1 B
3235,2372,PLAA EURK MJ-G C24-13 2 A
3236,2373,PLAA FREE MR-W E1-35 8 A
3237,2374,PLAA TRUA ND-H C24-0 1 A
3238,2375,PLEIADES SECTOR AV-Y C5 2 A
3239,2376,PLEIADES SECTOR AV-Y C7 1 A
3240,2376,PLEIADES SECTOR AV-Y C7 1 B
3241,2377,PLEIADES SECTOR BB-W B2-2 A 1
3242,2378,PLEIADES SECTOR BG-X C1-10 14 A
3243,2379,PLEIADES SECTOR BG-X C1-14 5 D
3244,2380,PLEIADES SECTOR CB-N B7-0 A 1
3245,2380,PLEIADES SECTOR CB-N B7-0 A 2
3246,2381,PLEIADES SECTOR CG-X C1-11 B 3
3247,2382,PLEIADES SECTOR CG-X C1-12 2
3248,2383,PLEIADES SECTOR CL-Y D43 A 5
3249,2384,PLEIADES SECTOR CQ-P B5-0 B 2
3250,2384,PLEIADES SECTOR CQ-P B5-0 C 1
3251,2385,PLEIADES SECTOR DB-X C1-10 B 2 A
3252,2386,PLEIADES SECTOR DG-O B6-0 1
3253,2387,PLEIADES SECTOR DG-X C1-11 A 3 A
3254,2388,PLEIADES SECTOR DG-X C1-14 AB 1 A
3255,2389,PLEIADES SECTOR DL-Y D46 6 A
3256,2390,PLEIADES SECTOR DQ-Y C4 6 A
3257,2391,PLEIADES SECTOR DW-M B7-0 4 A
3258,2391,PLEIADES SECTOR DW-M B7-0 4 B
3259,2392,PLEIADES SECTOR EB-X C1-2 ABC 3 C
3260,2393,PLEIADES SECTOR EC-U B3-0 4 A
3261,2394,PLEIADES SECTOR EH-U B3-2 A 3
3262,2394,PLEIADES SECTOR EH-U B3-2 C 1
3263,2394,PLEIADES SECTOR EH-U B3-2 C 2
3264,2395,PLEIADES SECTOR EL-Y D23 ABCD 1 A
3265,2396,PLEIADES SECTOR EL-Y D24 B 2
3266,2397,PLEIADES SECTOR EL-Y D29 3 A
3267,2398,PLEIADES SECTOR EL-Y D61 A 3 A
3268,2399,PLEIADES SECTOR FB-X C1-10 A 6
3269,2399,PLEIADES SECTOR FB-X C1-10 B 2
3270,2399,PLEIADES SECTOR FB-X C1-10 B 4
3271,2399,PLEIADES SECTOR FB-X C1-10 B 5
3272,2400,PLEIADES SECTOR FB-X C1-3 1
3273,2401,PLEIADES SECTOR FG-Y D32 D 7
3274,2402,PLEIADES SECTOR FM-V C2-7 2 A
3275,2403,PLEIADES SECTOR FR-V C2-2 B 1
3276,2403,PLEIADES SECTOR FR-V C2-2 B 2
3277,2404,PLEIADES SECTOR FR-V C2-7 A 2
3278,2405,PLEIADES SECTOR FW-W D1-37 2 A
3279,2406,PLEIADES SECTOR GG-Y D33 3 A
3280,2407,PLEIADES SECTOR GH-L B8-0 A 6
3281,2407,PLEIADES SECTOR GH-L B8-0 A 7
3282,2407,PLEIADES SECTOR GH-L B8-0 A 8
3283,2407,PLEIADES SECTOR GH-L B8-0 B 1
3284,2407,PLEIADES SECTOR GH-L B8-0 C 2
3285,2408,PLEIADES SECTOR GM-V B2-1 A 1
3286,2408,PLEIADES SECTOR GM-V B2-1 A 2
3287,2409,PLEIADES SECTOR GW-W C1-15 17 A
3288,2410,PLEIADES SECTOR GW-W D1-54 2 C
3289,2411,PLEIADES SECTOR GW-W D1-65 10 F
3290,2412,PLEIADES SECTOR HH-V C2-13 A 1 C
3291,2413,PLEIADES SECTOR HH-V C2-6 2 A
3292,2414,PLEIADES SECTOR HM-M B7-1 A 6
3293,2415,PLEIADES SECTOR HM-V B2-0 3
3294,2416,PLEIADES SECTOR HM-V C2-10 A 7
3295,2416,PLEIADES SECTOR HM-V C2-10 BC 1
3296,2417,PLEIADES SECTOR HR-W D1-16 1 A
3297,2418,PLEIADES SECTOR HR-W D1-26 C 2
3298,2418,PLEIADES SECTOR HR-W D1-26 D 4
3299,2418,PLEIADES SECTOR HR-W D1-26 E 3
3300,2418,PLEIADES SECTOR HR-W D1-26 E 4
3301,2418,PLEIADES SECTOR HR-W D1-26 E 5
3302,2419,PLEIADES SECTOR HR-W D1-66 A 3
3303,2419,PLEIADES SECTOR HR-W D1-66 B 3
3304,2419,PLEIADES SECTOR HR-W D1-66 B 4
3305,2419,PLEIADES SECTOR HR-W D1-66 B 5
3306,2420,PLEIADES SECTOR IH-V C2-16 C 4
3307,2420,PLEIADES SECTOR IH-V C2-16 D 2
3308,2420,PLEIADES SECTOR IH-V C2-16 D 3
3309,2421,PLEIADES SECTOR IH-V C2-3 1 B
3310,2422,PLEIADES SECTOR IH-V C2-5 2 A
3311,2423,PLEIADES SECTOR IM-V C2-16 ABC 2 A
3312,2424,PLEIADES SECTOR IR-W C1-1 1 A
3313,2425,PLEIADES SECTOR IR-W D1-37 B 4
3314,2426,PLEIADES SECTOR IR-W D1-38 ABCD 1 A
3315,2427,PLEIADES SECTOR IR-W D1-61 BC 1 A
3316,2428,PLEIADES SECTOR IR-W D1-76 B 3 A
3317,2429,PLEIADES SECTOR IX-S B4-1 10 A
3318,2430,PLEIADES SECTOR IX-S B4-4 A 6
3319,2430,PLEIADES SECTOR IX-S B4-4 A 7
3320,2430,PLEIADES SECTOR IX-S B4-4 A 8
3321,2430,PLEIADES SECTOR IX-S B4-4 B 1
3322,2430,PLEIADES SECTOR IX-S B4-4 B 2
3323,2430,PLEIADES SECTOR IX-S B4-4 B 3
3324,2431,PLEIADES SECTOR JC-U B3-2 1
3325,2431,PLEIADES SECTOR JC-U B3-2 2
3326,2432,PLEIADES SECTOR JC-V C2-9 1 A
3327,2433,PLEIADES SECTOR JM-W D1-52 2 A
3328,2434,PLEIADES SECTOR JS-T C3-17 1 A
3329,2435,PLEIADES SECTOR KC-V C2-4 7 A
3330,2436,PLEIADES SECTOR KH-V C2-1 2 A
3331,2437,PLEIADES SECTOR KH-V C2-3 3 A
3332,2438,PLEIADES SECTOR KH-V C2-7 7 F
3333,2439,PLEIADES SECTOR KM-W D1-40 B 10 A
3334,2440,PLEIADES SECTOR KS-S B4-1 A 6
3335,2441,PLEIADES SECTOR KT-Q B5-3 5 A
3336,2442,PLEIADES SECTOR LN-S B4-3 B 3
3337,2442,PLEIADES SECTOR LN-S B4-3 B 4
3338,2442,PLEIADES SECTOR LN-S B4-3 C 2
3339,2442,PLEIADES SECTOR LN-S B4-3 C 3
3340,2443,PLEIADES SECTOR LN-T C3-11 9 A
3341,2444,PLEIADES SECTOR LN-T C3-4 2 A
3342,2445,PLEIADES SECTOR LS-T C3-2 5 A
3343,2446,PLEIADES SECTOR LX-U C2-2 AB 4 A
3344,2447,PLEIADES SECTOR LY-Q B5-2 A 2
3345,2447,PLEIADES SECTOR LY-Q B5-2 A 3
3346,2448,PLEIADES SECTOR MC-V C2-0 1 A
3347,2449,PLEIADES SECTOR MC-V C2-6 B 4 A
3348,2450,PLEIADES SECTOR MC-V C2-8 8 B
3349,2451,PLEIADES SECTOR MM-V B2-2 1 B
3350,2452,PLEIADES SECTOR MN-T C3-9 B 1
3351,2453,PLEIADES SECTOR MS-T B3-1 A 2
3352,2454,PLEIADES SECTOR MX-U C2-1 1
3353,2455,PLEIADES SECTOR MX-U D2-54 4 E
3354,2456,PLEIADES SECTOR MX-U D2-63 1 A
3355,2457,PLEIADES SECTOR NN-T C3-15 A 3
3356,2457,PLEIADES SECTOR NN-T C3-15 A 4
3357,2457,PLEIADES SECTOR NN-T C3-15 A 5
3358,2458,PLEIADES SECTOR OD-S B4-1 2 A
3359,2459,PLEIADES SECTOR OI-T C3-7 A 6
3360,2459,PLEIADES SECTOR OI-T C3-7 B 3
3361,2459,PLEIADES SECTOR OI-T C3-7 B 4
3362,2460,PLEIADES SECTOR OS-U C2-6 A 5 B
3363,2461,PLEIADES SECTOR OS-U C2-7 4 A
3364,2462,PLEIADES SECTOR OY-R C4-19 A 3 A
3365,2463,PLEIADES SECTOR PD-S B4-0 B 5 A
3366,2463,PLEIADES SECTOR PD-S B4-0 B 5 B
3367,2464,PLEIADES SECTOR PI-T C3-9 A 2
3368,2464,PLEIADES SECTOR PI-T C3-9 A 3
3369,2464,PLEIADES SECTOR PI-T C3-9 A 4
3370,2464,PLEIADES SECTOR PI-T C3-9 B 1
3371,2465,PLEIADES SECTOR PN-S B4-1 A 6
3372,2465,PLEIADES SECTOR PN-S B4-1 B 3
3373,2465,PLEIADES SECTOR PN-S B4-1 B 4
3374,2465,PLEIADES SECTOR PN-S B4-1 B 5
3375,2465,PLEIADES SECTOR PN-S B4-1 B 6
3376,2466,PLEIADES SECTOR PN-T B3-0 A 2
3377,2466,PLEIADES SECTOR PN-T B3-0 A 3
3378,2466,PLEIADES SECTOR PN-T B3-0 A 5
3379,2466,PLEIADES SECTOR PN-T B3-0 A 6
3380,2466,PLEIADES SECTOR PN-T B3-0 A 7
3381,2466,PLEIADES SECTOR PN-T B3-0 B 2
3382,2466,PLEIADES SECTOR PN-T B3-0 B 3
3383,2466,PLEIADES SECTOR PN-T B3-0 B 4
3384,2467,PLEIADES SECTOR QJ-Q B5-2 B 2
3385,2467,PLEIADES SECTOR QJ-Q B5-2 B 3
3386,2468,PLEIADES SECTOR QT-R B4-0 AB 2
3387,2469,PLEIADES SECTOR RO-Q B5-0 4
3388,2470,PLEIADES SECTOR SE-P B6-0 C 3
3389,2470,PLEIADES SECTOR SE-P B6-0 C 4
3390,2470,PLEIADES SECTOR SE-P B6-0 D 1
3391,2470,PLEIADES SECTOR SE-P B6-0 D 2
3392,2470,PLEIADES SECTOR SE-P B6-0 D 3
3393,2471,PLEIADES SECTOR SI-T B3-0 2 A
3394,2472,PLEIADES SECTOR SP-N B7-0 B 2
3395,2473,PLEIADES SECTOR UK-N B7-3 A 5
3396,2474,PLEIADES SECTOR UT-Z B1 5 A
3397,2475,PLEIADES SECTOR UZ-X B1-2 A 1 C
3398,2476,PLEIADES SECTOR VF-N B7-0 B 1
3399,2476,PLEIADES SECTOR VF-N B7-0 B 2
3400,2477,PLEIADES SECTOR VK-N B7-0 C 1
3401,2478,PLEIADES SECTOR WE-Q B5-2 1 A
3402,2479,PLEIADES SECTOR XE-Q B5-2 C 3
3403,2479,PLEIADES SECTOR XE-Q B5-2 C 4
3404,2479,PLEIADES SECTOR XE-Q B5-2 C 5
3405,2479,PLEIADES SECTOR XE-Q B5-2 C 6
3406,2480,PLEIADES SECTOR XO-A C9 A 1
3407,2480,PLEIADES SECTOR XO-A C9 A 2
3408,2480,PLEIADES SECTOR XO-A C9 B 4
3409,2481,PLEIADES SECTOR XU-P B5-1 A 3
3410,2482,PLEIADES SECTOR XZ-Y C3 A 2
3411,2483,PLEIADES SECTOR YZ-Y C9 C 1
3412,2483,PLEIADES SECTOR YZ-Y C9 D 1
3413,2484,PLEIADES SECTOR ZE-A D40 C 3
3414,2485,PLEIADES SECTOR ZE-A D9 3 A
3415,2485,PLEIADES SECTOR ZE-A D9 5 A
3416,2485,PLEIADES SECTOR ZE-A D9 5 B
3417,2486,PLEIADES SECTOR ZK-W B2-1 B 1
3418,2487,PLEIADES SECTOR ZP-P B5-0 B 1
3419,2487,PLEIADES SECTOR ZP-P B5-0 B 2
3420,2488,PLEIADES SECTOR ZU-Y C1 4
3421,2489,PLEIADES SECTOR ZZ-Y C14 A 1 A
3422,2490,PLEIONE 11 A
3423,2490,PLEIONE 4
3424,2490,PLEIONE 6
3425,2491,PLIELE XE-T C6-29 2
3426,2492,PLIO AUWSY NJ-G D11-16 4 C
3427,2492,PLIO AUWSY NJ-G D11-16 6 B A
3428,2493,PLIO EURL QE-H D10-37 3 A
3429,2494,PLIPOE NX-X C16-0 C 6
3430,2495,PLOADAEA RU-W D2-0 1 D
3431,2496,PLOEA AIP IG-Y D47 5 A
3432,2497,PLOEA AIP RX-S C20-1 C 1
3433,2498,PLOEA BROU QX-L D7-215 B 6 D
3434,2499,PLOEA THEIA BK-A C6 1 E A
3435,2500,PLOEA THEIA OS-U D2-26 3 E
3436,2501,PLOI AEG TV-S C18-0 B 2
3437,2502,PLOI AEWSY KM-W F1-3 5
3438,2503,PLOI AEWSY OJ-Q E5-1 A 3
3439,2503,PLOI AEWSY OJ-Q E5-1 A 5
3440,2504,PLOI AIM AM-M D7-397 2
3441,2505,PLOI AIM EL-P C5-70 3 B
3442,2505,PLOI AIM EL-P C5-70 4 A
3443,2505,PLOI AIM EL-P C5-70 4 B
3444,2505,PLOI AIM EL-P C5-70 4 C
3445,2505,PLOI AIM EL-P C5-70 4 D
3446,2506,PLOI AIM HH-M C7-75 3 A
3447,2507,PLOI AIM IL-Y D228 A 10 B
3448,2507,PLOI AIM IL-Y D228 B 2 A
3449,2507,PLOI AIM IL-Y D228 B 2 B
3450,2507,PLOI AIM IL-Y D228 B 5 A
3451,2507,PLOI AIM IL-Y D228 B 5 C A
3452,2508,PLOI AIM JI-K C8-78 3
3453,2509,PLOI AIM KN-K C8-69 3 B
3454,2510,PLOI AIM LM-W D1-102 A 1
3455,2511,PLOI AIM QY-S D3-188 2 C
3456,2512,PLOI AIM SY-S D3-19 2 E A
3457,2513,PLOI BRIAE IP-Z C13-36 3 C
3458,2514,PLOI BRIAE LA-A D103 B 2 C A
3459,2515,PLOI BRIAE LW-E D11-107 3
3460,2516,PLOI BRIAE PK-I C9-32 AB 2 A
3461,2517,PLOI THUA BL-P E5-2 E 1 A
3462,2518,PLOI THUA CO-E C26-0 B 6 C
3463,2519,PLOI THUA MA-W B44-0 A 1 A
3464,2520,PLOI THUA TP-E C25-0 B 1 E
3465,2520,PLOI THUA TP-E C25-0 B 1 F
3466,2521,PLOI THUA WU-G D10-10 D 9 G
3467,2522,PLOXAO AE-A C17-0 B 4 C
3468,2523,PLUA AOB XO-A E5 2
3469,2524,PRAE DRYE XX-Z B33-4 ABC 4 A
3470,2525,PRAE FLYUAE VY-K B50-2 1
3471,2526,PRAEA EUQ AT-J B50-1 1
3472,2527,PRAEA EUQ BF-A D93 A 3
3473,2528,PRAEA EUQ CM-L C21-30 1 D A
3474,2529,PRAEA EUQ DJ-W B7-0 A 5 A
3475,2530,PRAEA EUQ EH-D D12-22 4
3476,2531,PRAEA EUQ FQ-P C5-17 A 3 A
3477,2532,PRAEA EUQ HF-S B45-3 A 1
3478,2532,PRAEA EUQ HF-S B45-3 B 5 A
3479,2533,PRAEA EUQ JI-B D13-104 1 A
3480,2534,PRAEA EUQ JW-F B52-4 3 A
3481,2535,PRAEA EUQ KP-M D8-0 3 A
3482,2536,PRAEA EUQ KT-Z D13-59 A 10 D
3483,2537,PRAEA EUQ LH-D C12-4 B 2
3484,2538,PRAEA EUQ LZ-S C3-21 6 A
3485,2539,PRAEA EUQ MM-W D1-75 B 1
3486,2540,PRAEA EUQ MU-E C25-2 9 A
3487,2540,PRAEA EUQ MU-E C25-2 9 B
3488,2540,PRAEA EUQ MU-E C25-2 9 C
3489,2541,PRAEA EUQ NF-R B4-8 A 1
3490,2542,PRAEA EUQ NG-Y D80 2 A
3491,2543,PRAEA EUQ OC-F B39-1 3 A
3492,2544,PRAEA EUQ OR-W B1-5 1
3493,2544,PRAEA EUQ OR-W B1-5 2
3494,2544,PRAEA EUQ OR-W B1-5 4 A
3495,2544,PRAEA EUQ OR-W B1-5 4 B
3496,2544,PRAEA EUQ OR-W B1-5 6 C A
3497,2545,PRAEA EUQ RE-K B8-7 8 A
3498,2546,PRAEA EUQ TF-K B36-4 2
3499,2547,PRAEA EUQ UG-S D5-0 B 3
3500,2548,PRAEA EUQ VH-V D2-46 4 C A
3501,2549,PRAEA EUQ VK-N C20-11 3 A
3502,2550,PRAEA EUQ XE-R E4-17 ABC 2
3503,2551,PRAEA EUQ ZC-Z C27-11 1
3504,2552,PRAEA EUQ ZW-H B37-7 B 3 A
3505,2553,PRAEI AEDST YS-P C19-0 6 B
3506,2554,PRAEI AIL CF-A C3 B 2 A
3507,2555,PRAEI FLEE LY-V B33-0 2 A
3508,2556,PRAI EON PF-E B58-4 A 4 B
3509,2557,PRAI HYPOO AN-E B2-0 B 2
3510,2557,PRAI HYPOO AN-E B2-0 B 5
3511,2558,PRAI HYPOO GF-E C10 B 4
3512,2559,PRAI HYPOO HF-E C7 B 6 A
3513,2560,PRAI HYPOO JQ-C C1-5 1 A
3514,2561,PRAI HYPOO KV-D C7 A 5
3515,2562,PRAI HYPOO MA-H B1-2 4 A
3516,2563,PRAI HYPOO PC-C D50 C 1
3517,2564,PRAI HYPOO QC-C D19 3 B
3518,2565,PRAI HYPOO QC-C D20 1 C A
3519,2566,PRAI HYPOO QC-C D31 2 A
3520,2567,PRAI HYPOO QC-C D32 3
3521,2567,PRAI HYPOO QC-C D32 4 A
3522,2568,PRAI HYPOO SX-B D10 A 3 A
3523,2569,PRAI HYPOO SX-B D23 AB 2 A
3524,2570,PRAI HYPOO SX-B D35 A 2 B A
3525,2571,PRAI HYPOO SX-B D36 2
3526,2572,PRAI HYPOO SX-B D39 1 A
3527,2573,PRAI HYPOO SX-B D46 4 A
3528,2574,PRAI HYPOO VG-G B1-1 AB 2
3529,2575,PRAI HYPOO VR-E B2-3 A 4 A
3530,2576,PRAI HYPOO WD-A D1-41 5 C
3531,2577,PRAI HYPOO WD-A D1-6 10 A
3532,2578,PRAI HYPOO WH-D B3-4 A 2 A
3533,2579,PRAI HYPOO YM-E B2-2 AB 1 A
3534,2580,PREAE AEC LP-Y B14-4 1
3535,2581,PREAE AIHM HS-A D1-3 3 B
3536,2582,PREAE AIN KN-Z C1-1 B 1
3537,2582,PREAE AIN KN-Z C1-1 B 2
3538,2582,PREAE AIN KN-Z C1-1 B 3
3539,2582,PREAE AIN KN-Z C1-1 B 4
3540,2582,PREAE AIN KN-Z C1-1 B 5
3541,2583,PREAE AIN KU-R B7-7 4
3542,2584,PREAE AIN LR-Y B36 A 2 A
3543,2585,PREAE AIN QI-B D82 C 3 A
3544,2586,PREAE AIN SV-P B8-5 C 1
3545,2587,PREAE AIN TE-Y D1-122 5 A
3546,2588,PREAE AIN VU-V C3-23 3 A
3547,2589,PREAE AIN WZ-X D1-5 A 5 A
3548,2590,PREAE AIN XU-X D1-47 A 3 A
3549,2591,PREAE AIN YP-X D1-96 2 E
3550,2592,PREAE AIN YU-X D1-8 3 B
3551,2593,PREAE AIP PI-B E1 AB 1 A
3552,2593,PREAE AIP PI-B E1 AB 1 D
3553,2594,PREAE CHROA BN-Z C27-8 B 3 B
3554,2595,PREIA PHIO WA-M D8-24 3 A A
3555,2596,PREIA PHOE AY-V B20-3 2 B
3556,2597,PREIA PHOE FX-A D1-865 B 1
3557,2598,PREIA PHOE ND-Z D1-702 B 3
3558,2599,PREIA PHOE OL-J D10-1917 2 A
3559,2600,PREIA PHOE SZ-O E6-6315 B 1
3560,2601,PREIA PRI CF-R D4-5 A 2 A
3561,2602,PREIA PRI KA-A D0 ABC 3 A
3562,2603,PREIA PRI LZ-S C3-0 C 2 A
3563,2603,PREIA PRI LZ-S C3-0 D 2 A
3564,2603,PREIA PRI LZ-S C3-0 D 3 B
3565,2604,PREIA PRI UF-A C1 A 1 A
3566,2605,PREIA PRI VD-T E3-1 4 A
3567,2606,PREOU AIL JG-N C20-45 B 4 C
3568,2607,PREOU THUA LK-G B27-0 A 3
3569,2608,PRIA CHREA UL-P C5-2 7 D
3570,2609,PRIA CHRIE UW-A C14-0 10 B
3571,2610,PRIA FRAAE WP-V D3-7 1 A
3572,2611,PRIELAEI KA-P C19-94 4 F
3573,2612,PRIELAEI MY-P B20-6 2 A
3574,2613,PRIELAEI QJ-I B39-1 1 A
3575,2614,PRIELAEI RW-H B38-1 AB 2
3576,2615,PRIELAEI RY-H D10-73 3 G A
3577,2616,PRIELAEI SK-E B42-3 4 D
3578,2616,PRIELAEI SK-E B42-3 5 A
3579,2617,PRIELAEI XH-X B46-1 A 2 B
3580,2618,PRIELEA GA-C C2-0 A 4
3581,2618,PRIELEA GA-C C2-0 BCD 1 A
3582,2618,PRIELEA GA-C C2-0 BCD 1 C
3583,2619,PRIELEA ND-Q D6-18 10 D
3584,2620,PRIELUIA EA-A E42 ABC 1
3585,2620,PRIELUIA EA-A E42 ABC 6 A
3586,2620,PRIELUIA EA-A E42 ABC 6 B
3587,2621,PRO AEC ZU-N D7-7 6 B
3588,2622,PRO AUWSY PS-S D4-9 BCD 2 A
3589,2623,PRO AUWSY QY-E C13-0 3 C A
3590,2624,PRO EUR RY-I C9-7 A 1 A
3591,2625,PRO EURL DG-M D8-1 8 D A
3592,2626,PRO EURL FF-Q D5-16 A 5
3593,2627,PRO EURL GL-O D6-18 C 1
3594,2628,PRO EURL HM-K D9-6 A 5 A A
3595,2629,PRO THAA TS-U B57-3 A 1 A
3596,2630,PROO BLE CL-Y G0 B 8 A
3597,2631,PROOE DRYEIA GC-U D3-0 B 7 A
3598,2632,PROOE DRYEIA XP-X D1-0 A 2 A
3599,2633,PROOE FLYI EH-E C27-5 1 B
3600,2633,PROOE FLYI EH-E C27-5 1 C
3601,2634,PROOE FLYUAE FQ-Y E662 3 B A
3602,2635,PROOE HYPA CJ-R C21-38 A 3 C
3603,2635,PROOE HYPA CJ-R C21-38 A 4 A
3604,2635,PROOE HYPA CJ-R C21-38 A 4 B
3605,2635,PROOE HYPA CJ-R C21-38 A 5 A
3606,2636,PROOE PHIO GP-W C3-5 B 3 A
3607,2637,PRU AED BP-A D36 B 1
3608,2638,PRU AED GG-O D6-36 AB 2 B A
3609,2639,PRU AED KW-M C7-8 1 A
3610,2639,PRU AED KW-M C7-8 1 B
3611,2640,PRU AED NR-S B18-1 A 2 A
3612,2640,PRU AED NR-S B18-1 B 4 A
3613,2641,PRU AED VO-N B21-2 B 1 A
3614,2642,PRU AED VT-R D4-17 C 1 C A
3615,2643,PRU AED XO-R D4-50 B 2
3616,2644,PRU AED ZZ-F C11-9 4 A
3617,2645,PRU AERB QX-U D2-1 B 1
3618,2646,PRU AESCS AF-Y C14-44 A 4
3619,2647,PRU AESCS AK-W B29-14 B 1
3620,2647,PRU AESCS AK-W B29-14 B 3 A
3621,2648,PRU AESCS AL-U B30-6 1
3622,2649,PRU AESCS DL-W C15-48 1 A
3623,2650,PRU AESCS EL-W C15-25 4 A
3624,2651,PRU AESCS MO-Z D13-93 A 4
3625,2652,PRU AESCS MX-C B54-5 1
3626,2653,PRU AESCS MX-T B58-13 2 A
3627,2653,PRU AESCS MX-T B58-13 2 B
3628,2654,PRU AESCS NC-M D7-192 A 3 A
3629,2654,PRU AESCS NC-M D7-192 A 5 C A
3630,2654,PRU AESCS NC-M D7-192 B 1
3631,2655,PRU AESCS NC-M D7-201 9 A
3632,2656,PRU AESCS NC-M D7-51 2
3633,2657,PRU AESCS NC-M D7-71 2 B
3634,2658,PRU AESCS NC-M D7-88 A 2 D
3635,2659,PRU AESCS NC-M D7-96 3
3636,2660,PRU AESCS NY-Q C18-40 1 B
3637,2660,PRU AESCS NY-Q C18-40 1 F A
3638,2661,PRU AESCS OX-L D7-297 1 D
3639,2662,PRU AESCS PV-Q B46-5 B 1
3640,2662,PRU AESCS PV-Q B46-5 B 2
3641,2663,PRU AESCS QG-Z B31-1 A 3 A
3642,2664,PRU AESCS QI-T E3-22 6
3643,2665,PRU AESCS WT-Y C14-23 5 B
3644,2666,PRU AIM PN-S D4-80 3
3645,2667,PRU AIN BG-E D12-46 4 G A
3646,2668,PRU AUB DL-P E5-35 ABC 6
3647,2669,PRU EUQ JX-I D10-1 A 4
3648,2670,PRU EUQ KC-H B51-3 BC 1 A
3649,2671,PRU EUQ LM-T D4-1 2 A
3650,2672,PRU EUQ LS-A D14-9 C 1
3651,2673,PRU EUQ LZ-W B42-8 AB 3 C
3652,2674,PRU EUQ MT-T C19-0 4 E A
3653,2675,PRU EURK EC-B D14-9 1
3654,2676,PRU EURK TF-P B35-0 5 A
3655,2677,PRU EURK UD-B C29-1 ABC 1
3656,2678,PRU EURK VP-O E6-1 A 2
3657,2679,PRUA DRYOAE GH-C C29-3 A 4 B
3658,2680,PRUA HYPAI FR-F B58-10 A 2
3659,2681,PRUA PHIO ZL-T D4-56 1
3660,2681,PRUA PHIO ZL-T D4-56 2
3661,2682,PRUA PHOE AB-R C7-68 4
3662,2683,PRUA PHOE AF-Z E45 1
3663,2684,PRUA PHOE BC-P C21-1 2 D A
3664,2684,PRUA PHOE BC-P C21-1 3 A
3665,2684,PRUA PHOE BC-P C21-1 5 A
3666,2685,PRUA PHOE GH-T D4-117 A 1 A
3667,2686,PRUA PHOE JM-L D8-57 1 C A
3668,2686,PRUA PHOE JM-L D8-57 2 C
