id,system,bodyName
1,1,10 ARIETIS A 1
2,2,102 IOTA TAURI B 2 A
3,3,139 TAURI A 2 A
4,3,139 TAURI A 2 B
5,3,139 TAURI A 5
6,3,139 TAURI B 1
7,4,16 H ORIONIS ABC 2 C A
8,5,164 G. CANIS MAJORIS 5 C A
9,6,2MASS J10433563-5945136 1 A
10,6,2MASS J10433563-5945136 2 A
11,6,2MASS J10433563-5945136 2 B
12,7,2MASS J10433739-6005084 B 1 A
13,7,2MASS J10433739-6005084 B 2 D
14,8,2MASS J10444160-5947046 1 B
15,8,2MASS J10444160-5947046 2 B A
16,9,2MASS J14272268-5940166 C 1
17,9,2MASS J14272268-5940166 C 2
18,10,2MASS J14274501-5937518 A 5
19,10,2MASS J14274501-5937518 A 6 A
20,10,2MASS J14274501-5937518 A 6 B
21,11,2MASS J18171704-1659394 A 1
22,12,2MASS J18175838-1702401 4
23,13,2MASS J18181264-1654135 1 A
24,14,2MASS J18182881-1649403 A 6 B
25,14,2MASS J18182881-1649403 A 6 C A
26,14,2MASS J18182881-1649403 A 7 A
27,14,2MASS J18182881-1649403 A 7 B
28,15,2MASS J18182894-1645056 A 1
29,16,2MASS J18183883-1645311 B 3
30,17,2MASS J18184271-1658059 2 A
31,17,2MASS J18184271-1658059 4 C A
32,18,2MASS J18185300-1638082 4
33,19,2MASS J18185936-1641019 4
34,20,2MASS J18191417-1629510 AB 6 A
35,21,2MASS J18192192-1630004 2 A
36,22,2MASS J18192265-1631091 5 A
37,23,2MASS J18192359-1632298 ABCD 5 A
38,24,2MASS J18194800-1644152 8 A
39,24,2MASS J18194800-1644152 8 B
40,25,2MASS J18202544-1636087 5 A
41,26,35 G. CARINAE 1 E
42,27,4 CAMELOPARDALIS 10 C A
43,28,5 PUPPIS B 1
44,29,5 RHO SCORPII 6 A
45,29,5 RHO SCORPII 7 F
46,30,57 HYDRAE 8
47,31,61 CYGNI A 1
48,32,63 G. CAPRICORNI 4
49,33,64 ARIETIS 2
50,34,64 VIRGINIS 4 C
51,35,70 G. CARINAE 10 C
52,35,70 G. CARINAE 6 A
53,36,72 TAURI 1 C A
54,37,78 URSAE MAJORIS A 1
55,38,AEDGORN AG-O D6-2 A 1
56,38,AEDGORN AG-O D6-2 A 2 A
57,39,AEDGORN DL-P D5-0 A 1
58,40,AEDGORN XK-O D6-2 A 1
59,40,AEDGORN XK-O D6-2 ABC 4 A C
60,41,AEMORRS JJ-F D12-6487 5
61,42,AEMORRS WO-A E2950 AB 2
62,43,AGNAIMT YC-H D11-85 1
63,44,AIDOW BC-D D12-4 1
64,45,AIPHAIRDS FB-E D12-306 1
65,46,AIPHAISTY AB-O D6-159 B 4 A
66,47,AIPHAISTY LX-U E2-24 AB 2 C
67,48,AIPHAISTY XJ-A D55 3
68,49,AISHAISH BL-P C5-155 B 2
69,50,ALAUNUS 10
70,51,ALNITAK 4 A
71,52,AOWRIAE HG-Y E2203 B 1
72,53,ARIES DARK REGION AQ-Y D14 4 A
73,54,ARIES DARK REGION DB-X C1-2 B 1
74,55,ARIES DARK REGION DB-X C1-7 A 9 A
75,56,ARIES DARK REGION DB-X D1-63 A 7 A
76,57,ARIES DARK REGION DB-X D1-64 4 A
77,58,ARIES DARK REGION FW-W D1-59 A 5 A
78,59,ARIES DARK REGION FW-W D1-76 4 A
79,60,ARIES DARK REGION GW-W D1-48 6 A
80,61,ARIES DARK REGION GW-W D1-86 1 B
81,62,ARIES DARK REGION HR-W C1-1 8 C
82,63,ARIES DARK REGION HR-W D1-34 2 A
83,64,ARIES DARK REGION HR-W D1-44 B 2 A
84,65,ARIES DARK REGION HR-W D1-53 7 A
85,66,ARIES DARK REGION HR-W D1-54 2 C A
86,67,ARIES DARK REGION IH-V C2-9 6 B
87,68,ARIES DARK REGION IM-V C2-5 12 A
88,69,ARIES DARK REGION JC-V C2-6 A 4 A
89,70,ARIES DARK REGION JS-T C3-1 1 A
90,71,ARIES DARK REGION JW-W C1-4 7 A
91,72,ARIES DARK REGION KH-V C2-4 7 A
92,73,ARIES DARK REGION MS-T C3-15 1 A
93,74,ARIES DARK REGION MS-T C3-2 A 1 A
94,75,ARIES DARK REGION MS-T C3-8 A 9 A
95,75,ARIES DARK REGION MS-T C3-8 A 9 B
96,75,ARIES DARK REGION MS-T C3-8 A 9 C
97,75,ARIES DARK REGION MS-T C3-8 A 9 D
98,76,ARIES DARK REGION MX-U C2-10 1 C
99,77,ARIES DARK REGION MX-U C2-8 A 7 A
100,78,ARIES DARK REGION NN-T C3-12 1 D
101,79,ARIES DARK REGION OD-S B4-1 A 3
102,80,ARIES DARK REGION OI-T C3-8 1 A
103,81,ARIES DARK REGION PY-R B4-1 A 4 A
104,82,ARIES DARK REGION VT-R B4-0 A 6
105,83,ARIETIS SECTOR ZE-A D75 10 A
106,84,ARMSTRONG C 2
107,85,ASSAIPY LD-K D8-71 2 B
108,86,ATHAIR YO-I D9-272 2 C A
109,87,ATHENA AB 1 E A
110,88,AUCOKS HC-U B33-0 3 B
111,89,AUCOKS UR-N C22-0 1
112,90,AUCOPP ES-H D11-2 2
113,91,AUNAIR EG-Y E252 4 B
114,92,AUPHAIRSTS DX-A D1-74 AB 3 A
115,93,AUPHAIRSTS PA-T B37-0 6 D A
116,94,AUSANTUATEL 1
117,95,BALIE A 1 C A
118,96,BANKI A 3 A
119,97,BARATI A 1
120,98,BATZ 2 A
121,98,BATZ 2 B
122,98,BATZ 2 C
123,98,BATZ 3 A
124,98,BATZ 4 A
125,99,BAULOO LX-U E2-17 D 14 B
126,100,BD-10 1848 4
127,101,BD-11 4932 1
128,102,BD-12 1172 1
129,102,BD-12 1172 10 A
130,102,BD-12 1172 10 B
131,102,BD-12 1172 2
132,102,BD-12 1172 4
133,102,BD-12 1172 5 A
134,102,BD-12 1172 7
135,103,BD+38 2037 A 1
136,104,BD+47 2936 2
137,105,BD+60 456 8 F
138,106,BELAAKO AB 1 C A
139,107,BETA HYDRI 7 C
140,108,BHOTHO AB 1 A
141,109,BLA PHROEA HS-H D11-0 C 1
142,110,BLA PHROEA TK-C D14-0 1 A
143,110,BLA PHROEA TK-C D14-0 4 B
144,111,BLAA EAEC NL-L C9-136 B 5 A
145,112,BLAA EAEC UE-I B55-6 6 B
146,113,BLAA FLYAO EA-M C9-2 ABC 3 D
147,114,BLAA FLYI ON-B B27-0 A 1 B
148,115,BLAA HYPAI CQ-X D1-21 1
149,116,BLAA HYPAI CZ-D C13-0 8 B
150,116,BLAA HYPAI CZ-D C13-0 8 C
151,117,BLAA HYPAI DD-I B26-0 B 4 A
152,118,BLAA HYPAI DZ-D C13-1 B 6 A
153,119,BLAA HYPAI EU-D C13-0 B 4
154,120,BLAA HYPAI GG-V C3-4 3
155,121,BLAA HYPAI HW-V D2-6 1 B
156,122,BLAA HYPAI HY-H B26-1 A 2
157,123,BLAA HYPAI KT-Y B17-1 C 2
158,124,BLAA HYPAI LZ-F B27-0 A 2
159,124,BLAA HYPAI LZ-F B27-0 A 5
160,125,BLAA HYPAI OZ-O D6-16 4 C
161,126,BLAA HYPAI UO-L B10-1 1 C
162,127,BLAA HYPAI XR-I B26-0 A 3
163,128,BLAA PHOE AA-A G2 C 1 A
164,129,BLAA PHOE GM-B C27-55 A 1
165,129,BLAA PHOE GM-B C27-55 A 2
166,130,BLAA PHOE HP-J C24-151 A 6 A
167,130,BLAA PHOE HP-J C24-151 ABC 1 A
168,130,BLAA PHOE HP-J C24-151 ABC 2 A
169,130,BLAA PHOE HP-J C24-151 ABC 2 B
170,130,BLAA PHOE HP-J C24-151 ABC 2 C
171,130,BLAA PHOE HP-J C24-151 ABC 2 D
172,130,BLAA PHOE HP-J C24-151 ABC 2 E
173,130,BLAA PHOE HP-J C24-151 ABC 3 D
174,130,BLAA PHOE HP-J C24-151 ABC 3 E
175,131,BLAA PHOE HW-D D12-156 1
176,132,BLAA PHOE IA-M B38-12 2 A
177,132,BLAA PHOE IA-M B38-12 2 B
178,132,BLAA PHOE IA-M B38-12 3 A
179,133,BLAA PHOE MN-E B53-11 2 A
180,134,BLAA PHOE NZ-Z C33 B 1 F
181,135,BLAA PHOE OR-V D2-174 1
182,136,BLAA PHOE QK-D D13-553 A 1
183,137,BLAA PHOE RE-E B55-16 A 1
184,138,BLAA PHOE RY-P B7-8 3 A
185,138,BLAA PHOE RY-P B7-8 3 A A
186,139,BLAA PHOE TI-B C29-242 3 A
187,140,BLAA PHOE VG-O B51-19 B 1
188,140,BLAA PHOE VG-O B51-19 B 3
189,141,BLAA PHOE XO-Q D5-241 A 2
190,142,BLAA PHOE YK-G B27-10 5 A
191,142,BLAA PHOE YK-G B27-10 5 B
192,142,BLAA PHOE YK-G B27-10 5 C
193,142,BLAA PHOE YK-G B27-10 6 A
194,142,BLAA PHOE YK-G B27-10 6 B
195,142,BLAA PHOE YK-G B27-10 6 C
196,143,BLAA PHOE YR-O C21-23 1 A
197,143,BLAA PHOE YR-O C21-23 4 A
198,143,BLAA PHOE YR-O C21-23 4 B
199,143,BLAA PHOE YR-O C21-23 4 C
200,143,BLAA PHOE YR-O C21-23 5 A
201,144,BLAE DRYE DF-I B57-6 1
202,145,BLAE DRYE PE-E D13-6 4 A
203,145,BLAE DRYE PE-E D13-6 4 B
204,146,BLAE DRYE PP-A C29-7 3 C
205,147,BLAE DRYE QZ-D D13-103 6 B
206,148,BLAE DRYE SM-Y B58-0 A 2
207,148,BLAE DRYE SM-Y B58-0 A 3
208,148,BLAE DRYE SM-Y B58-0 B 1
209,149,BLAE DRYE TK-C D14-37 ABC 2 A
210,150,BLAE DRYE VM-G B58-13 D 1
211,150,BLAE DRYE VM-G B58-13 D 2
212,150,BLAE DRYE VM-G B58-13 D 3
213,151,BLAE DRYE WU-O E6-3 B 1
214,152,BLAE DRYE XU-O E6-22 2
215,153,BLAE DRYE YV-B D14-25 3
216,154,BLAE EORK IF-G C27-13 A 1
217,155,BLAE EORK NE-E D13-25 B 2
218,156,BLAE EORK QU-D D13-3 3
219,157,BLAE EORK RK-C D14-15 7 A
220,157,BLAE EORK RK-C D14-15 8 C
221,158,BLAE EORK RU-D D13-17 1 A
222,159,BLAE EORK RU-D D13-20 5 A
223,159,BLAE EORK RU-D D13-20 5 D
224,159,BLAE EORK RU-D D13-20 7 A
225,160,BLAE EORK UL-J B56-1 A 2
226,160,BLAE EORK UL-J B56-1 A 3
227,161,BLAE HYPUE SW-E B28-1 1 B
228,162,BLAEA BRAI XN-B C13-9 A 2 A
229,162,BLAEA BRAI XN-B C13-9 B 2 A
230,162,BLAEA BRAI XN-B C13-9 B 3 B
231,162,BLAEA BRAI XN-B C13-9 B 5 B
232,163,BLANCO 1 SECTOR GW-T B4-0 1
233,164,BLANCO 1 SECTOR TZ-U B4-0 1
234,165,BLAU BROAE BC-D D12-59 B 4 A
235,166,BLAU THUA QH-Z C2-0 3 B
236,167,BLAU THUA SC-Z C2-0 3 D
237,168,BLEA AIRGH IH-M D7-0 3 A
238,169,BLEA AIRGH LO-O C20-0 A 1
239,170,BLEAE AEWSY GV-X D1-27 3 B
240,171,BLEAE AEWSY IF-R D4-14 2 D
241,172,BLEAE AEWSY LE-M B10-1 A 2
242,173,BLEAE BRIAE HX-L D7-100 B 2 D
243,174,BLEAE EURK FG-Y G2 A 1
244,175,BLEAE THAA NZ-C C1-0 A 2 D
245,176,BLEAE THUA BI-D C12-5 7 A
246,177,BLEAE THUA CA-L C10-1 1
247,177,BLEAE THUA CA-L C10-1 4
248,177,BLEAE THUA CA-L C10-1 6 B
249,177,BLEAE THUA CA-L C10-1 6 G
250,177,BLEAE THUA CA-L C10-1 7 D A
251,178,BLEAE THUA HK-Z D5 7 C
252,179,BLEAE THUA HL-E B13-1 5 B
253,180,BLEAE THUA ME-U B44-0 2
254,181,BLEAE THUA ML-N C20-20 2 A
255,182,BLEAE THUA NZ-G B55-0 2 E
256,183,BLEAE THUA VW-N C6-13 A 1 A
257,183,BLEAE THUA VW-N C6-13 A 1 D
258,184,BLEAE THUA XF-A C15 3 A
259,185,BLEAE THUA XY-S D3-41 A 5
260,186,BLEAE THUA ZW-A C27-15 3 B
261,187,BLEETHOAE CM-C D13-208 7 A
262,188,BLEETHU TY-W C16-4 B 1 A
263,189,BLEETHUAE CC-B C1-229 B 5
264,190,BLEETHUAE JS-B D150 5 A
265,191,BLEETHUAE KK-L C9-9 1
266,192,BLEETHUAE LN-B D1183 2 B
267,192,BLEETHUAE LN-B D1183 2 D
268,193,BLEETHUAE MN-B D1365 7 A
269,194,BLEETHUAE NI-B D674 2 B
270,194,BLEETHUAE NI-B D674 2 D A
271,195,BLEETHUAE PF-U C4-14 2
272,196,BLEETHUAE TK-D C4 B 11 A
273,196,BLEETHUAE TK-D C4 B 11 B
274,197,BLEETHUAE WU-V C3-42 A 2 A
275,198,BLEETHUAE XV-C C285 A 3 A
276,199,BLEIA BYOE CQ-X C1-1 D 4 A
277,200,BLEIA DRYIAE AC-S D5-114 C 1
278,201,BLEIA DRYIAE EK-C D14-102 1 A
279,201,BLEIA DRYIAE EK-C D14-102 1 B
280,201,BLEIA DRYIAE EK-C D14-102 1 C
281,201,BLEIA DRYIAE EK-C D14-102 2 C
282,201,BLEIA DRYIAE EK-C D14-102 3 A
283,201,BLEIA DRYIAE EK-C D14-102 3 B
284,201,BLEIA DRYIAE EK-C D14-102 3 C
285,201,BLEIA DRYIAE EK-C D14-102 3 D
286,201,BLEIA DRYIAE EK-C D14-102 4 A
287,202,BLEIA DRYIAE EK-C D14-18 4 A
288,203,BLEIA DRYIAE EO-W B35-0 A 1
289,204,BLEIA DRYIAE HN-S E4-37 B 1
290,205,BLEIA DRYIAE IH-K C25-36 C 2
291,206,BLEIA DRYIAE II-I C26-20 2 A
292,207,BLEIA DRYIAE MA-M B54-8 B 1 A
293,208,BLEIA DRYIAE NF-C D14-89 C 1
294,209,BLEIA DRYIAE UP-F B44-1 C 1
295,210,BLEIA DRYIAE WF-L D9-176 4
296,211,BLEIA DRYIAE ZQ-E B59-8 A 6
297,211,BLEIA DRYIAE ZQ-E B59-8 B 1
298,211,BLEIA DRYIAE ZQ-E B59-8 B 2
299,212,BLEIA EOHN LM-Y C3-13 6 A
300,213,BLEIA EOHN LO-T B9-3 1 A
301,213,BLEIA EOHN LO-T B9-3 2 A
302,214,BLEIA EOHN SR-Y B58-0 4 A
303,215,BLEIA EOHN TK-C C27-0 A 3
304,215,BLEIA EOHN TK-C C27-0 A 4 A
305,215,BLEIA EOHN TK-C C27-0 A 4 D
306,215,BLEIA EOHN TK-C C27-0 A 5 A
307,216,BLEIA EOHN VR-W C4-0 A 1
308,217,BLEIA EOHN YP-K C23-2 3 B A
309,218,BLEIA FLYUAE KZ-F C11-1 8 C
310,219,BLIE AICK BA-A G0 B 1 A
311,220,BLIE AICK LR-W E1-3 3
312,220,BLIE AICK LR-W E1-3 5
313,221,BLIE AICK VA-Z C11 B 2 B
314,222,BLIE PHLA VP-B C28-2 7 A
315,223,BLO AESCS KN-S E4-361 ABCD 2
316,223,BLO AESCS KN-S E4-361 ABCD 4
317,224,BLO AESCS RR-U C19-18 4 A
318,225,BLO AESCS UL-L B41-1 C 4 A
319,226,BLO AESCS YY-A D80 1 C A
320,227,BLO AIRM CB-W E2-0 1
321,228,BLODES A 2
322,229,BLU EUQ BM-C D13-24 AB 1 A
323,229,BLU EUQ BM-C D13-24 ABC 1 C A
324,230,BLU EUQ IP-K B10-0 B 2
325,231,BLU THUA AE-T B3-5 1
326,231,BLU THUA AE-T B3-5 5 A
327,232,BLU THUA AI-A C14-10 A 4 A
328,233,BLU THUA BR-U C16-0 A 2 A
329,234,BLU THUA EM-K B22-2 AB 1 A
330,234,BLU THUA EM-K B22-2 ABC 2 A
331,235,BLU THUA EW-T B17-5 3 A
332,236,BLU THUA GB-O C6-9 C 1
333,237,BLU THUA GI-B B55-2 4 A
334,238,BLU THUA HR-N D6-60 A 5 A
335,239,BLU THUA JS-M B35-2 3
336,240,BLU THUA KF-K B36-1 1
337,241,BLU THUA LF-M C21-11 A 1
338,242,BLU THUA MA-W B29-3 A 9 A
339,243,BLU THUA NL-F B11-5 A 4 A
340,243,BLU THUA NL-F B11-5 A 4 B
341,244,BLU THUA NN-J B9-2 A 6 C
342,245,BLU THUA OO-X D2-1 1 A
343,246,BLU THUA TS-X C28-6 3
344,247,BLUA EAEC AG-X E1-2095 7
345,248,BLUA EAEC AN-E C14-357 5 A
346,249,BLUA EAEC AN-E C14-41 1 A
347,250,BLUA EAEC BX-G C12-26 C 3 A
348,251,BLUA EAEC EW-V E2-3175 6 A
349,252,BLUA EAEC EW-V E2-3617 AB 11 A
350,252,BLUA EAEC EW-V E2-3617 AB 11 H A
351,252,BLUA EAEC EW-V E2-3617 AB 11 J
352,253,BLUA EAEC EW-V E2-4218 7
353,254,BLUA EAEC IC-U E3-902 A 1
354,254,BLUA EAEC IC-U E3-902 A 3
355,254,BLUA EAEC IC-U E3-902 A 4
356,255,BLUA EAEC KT-F D12-830 2
357,256,BLUA EAEC LD-Q D6-1538 AB 1 A
358,256,BLUA EAEC LD-Q D6-1538 B 4
359,257,BLUA EAEC LK-W B6-21 8 B
360,258,BLUA EAEC MM-M C23-188 BC 1 A
361,259,BLUA EAEC PJ-O D7-1262 8 D
362,260,BLUA EAEC ST-Y D1-517 1 A
363,261,BLUA EAEC WG-G C13-307 7 D
364,262,BLUA EAEC ZE-A G29 12 A
365,263,BLUA HYPUE JX-R D5-242 3
366,264,BLUA HYPUE OF-E D12-87 B 2 A
367,265,BLUA HYPUE OV-C D13-210 3
368,266,BLUE PHROEA EK-C D14-0 C 1
369,267,BLUE PHROEA EY-G D11-0 B 2
370,268,BOEKH UM-O C8-64 2 G A
371,269,BOELTS DY-I B4 10 A
372,270,BOELTS YK-X E1-626 5
373,271,BOELTS ZH-U C19-468 3
374,272,BOEPH FU-B C2-8 4 A
375,273,BOEPH TT-H D10-1451 4
376,274,BOEPP XA-D D13-2289 B 8 E
377,275,BOEPP XA-D D13-2791 7 D
378,276,BOEPP ZK-O E6-226 15 C A
379,277,BOEPPY XZ-X D1-13 6 A
380,278,BOERTH BT-Q B9-47 7 C
381,279,BOERTH FN-H D11-3298 3 A
382,280,BOETZ TL-U B20-0 3 C
383,281,BOEWNST CB-W C18-748 A 4 A
384,281,BOEWNST CB-W C18-748 B 4
385,282,BOEWNST CT-F D12-2430 1 A
386,283,BOEWNST CV-P D5-631 CD 1
387,284,BOEWNST DH-U E3-8179 A 1
388,285,BOEWNST EM-E B2-34 B 2 A
389,285,BOEWNST EM-E B2-34 B 3 A
390,285,BOEWNST EM-E B2-34 B 4 A
391,285,BOEWNST EM-E B2-34 B 4 B
392,285,BOEWNST EM-E B2-34 B 4 C
393,285,BOEWNST EM-E B2-34 B 5 A
394,285,BOEWNST EM-E B2-34 B 6 A
395,285,BOEWNST EM-E B2-34 B 6 B
396,286,BOEWNST ES-H B43-30 5 E
397,287,BOEWNST FO-F D12-4094 1
398,287,BOEWNST FO-F D12-4094 2
399,287,BOEWNST FO-F D12-4094 3
400,287,BOEWNST FO-F D12-4094 4
401,287,BOEWNST FO-F D12-4094 6
402,287,BOEWNST FO-F D12-4094 7
403,288,BOEWNST GM-U C19-2109 B 7
404,289,BOEWNST HN-S E4-325 A 6 D A
405,290,BOEWNST JS-J C25-1327 7 A
406,291,BOEWNST KJ-O D7-2934 AB 2
407,292,BOEWNST KS-S C20-959 A 2 A
408,293,BOEWNST KS-S C20-969 2 A
409,294,BOEWNST LO-Z B4-20 1 A
410,294,BOEWNST LO-Z B4-20 1 B
411,294,BOEWNST LO-Z B4-20 1 D
412,294,BOEWNST LO-Z B4-20 1 E
413,294,BOEWNST LO-Z B4-20 2 A
414,294,BOEWNST LO-Z B4-20 2 B
415,295,BOEWNST LU-D D13-5628 B 1
416,295,BOEWNST LU-D D13-5628 B 2
417,295,BOEWNST LU-D D13-5628 B 3
418,296,BOEWNST LU-M D8-3748 A 1 A
419,296,BOEWNST LU-M D8-3748 A 1 B
420,296,BOEWNST LU-M D8-3748 A 1 C
421,296,BOEWNST LU-M D8-3748 A 1 D
422,296,BOEWNST LU-M D8-3748 A 3 A
423,296,BOEWNST LU-M D8-3748 A 3 B
424,296,BOEWNST LU-M D8-3748 A 3 C
425,296,BOEWNST LU-M D8-3748 A 3 D
426,296,BOEWNST LU-M D8-3748 A 3 E
427,296,BOEWNST LU-M D8-3748 A 3 F
428,297,BOEWNST MC-L C24-418 3 A
429,297,BOEWNST MC-L C24-418 3 B
430,297,BOEWNST MC-L C24-418 4 A
431,297,BOEWNST MC-L C24-418 4 B
432,298,BOEWNST MN-S C20-117 B 1
433,298,BOEWNST MN-S C20-117 B 1 A
434,299,BOEWNST NE-O D7-1394 1
435,300,BOEWNST NG-G C13-2 2
436,300,BOEWNST NG-G C13-2 3
437,300,BOEWNST NG-G C13-2 3 A
438,300,BOEWNST NG-G C13-2 3 B
439,301,BOEWNST OA-L D9-1285 B 3 A
440,301,BOEWNST OA-L D9-1285 B 4
441,301,BOEWNST OA-L D9-1285 B 4 A
442,302,BOEWNST OA-L D9-3853 3 A
443,303,BOEWNST OA-L D9-4513 2
444,304,BOEWNST PA-L D9-4002 B 5
445,304,BOEWNST PA-L D9-4002 B 7 A
446,305,BOEWNST PT-Q C21-905 A 3 A
447,306,BOEWNST RE-G C27-1075 A 1
448,307,BOEWNST RL-J D10-1594 6 A
449,308,BOEWNST SG-J D10-4272 6 B
450,309,BOEWNST SJ-P C22-1176 A 5
451,309,BOEWNST SJ-P C22-1176 A 6 A
452,310,BOEWNST SV-B D14-928 A 1
453,310,BOEWNST SV-B D14-928 B 1
454,310,BOEWNST SV-B D14-928 B 4 A
455,310,BOEWNST SV-B D14-928 B 6 A
456,311,BOEWNST TG-J D10-1066 3 A
457,312,BOEWNST TG-J D10-1093 1 A
458,313,BOEWNST TG-J D10-488 6 A
459,313,BOEWNST TG-J D10-488 6 A A
460,314,BOEWNST TG-J D10-5134 6 A
461,315,BOEWNST TZ-M B40-241 1
462,316,BOEWNST WK-L C9-4 3 C
463,317,BOEWNST ZF-E C12-104 A 1
464,318,BOEWNST ZJ-R D4-26 A 2 A
465,319,BOEWNST ZT-Z D604 A 2
466,320,BRAIREE YJ-A F4625 B 3
467,321,BRESTLA A 14 C A
468,322,BUBBLE SECTOR LX-T B3-1 1 A
469,323,BUZHANG KU 3 B
470,324,BYA AIL TY-S E3-276 1
471,325,BYA CHRAEA GR-W D1-23 C 5 D
472,326,BYAA AIN QA-J C11-144 4
473,327,BYAA AIN YO-Z D1902 A 2 B
474,328,BYAA AIN YP-V D3-295 B 2 B
475,329,BYAA AIN YP-V D3-654 1 A
476,329,BYAA AIN YP-V D3-654 1 C
477,329,BYAA AIN YP-V D3-654 1 C A
478,329,BYAA AIN YP-V D3-654 1 D
479,329,BYAA AIN YP-V D3-654 1 E
480,330,BYAA BROAE VY-S C3-2 B 1
481,331,BYAA FLEE MT-N C21-0 C 3 A
482,331,BYAA FLEE MT-N C21-0 D 1
483,332,BYAA THEIA WO-R E4-3 A 3
484,333,BYAE AIRG EE-B C39 AB 3 A
485,334,BYAE AOWSY GR-N D6-52 4 D A
486,335,BYEIA CHREA OQ-R C6-2 AB 1 A
487,336,BYEIA EUQ OG-Y D221 A 1 C
488,337,BYEIA EUQ SF-W C15-30 7 A
489,338,BYEIA EUR BA-A G3 1
490,339,BYEIA EURK AS-J C22-43 2
491,340,BYEIA EURK BF-R E4-32 1
492,340,BYEIA EURK BF-R E4-32 5
493,341,BYEIA EURK BF-R E4-7 8 B A
494,341,BYEIA EURK BF-R E4-7 8 C A
495,342,BYEIA EURK BF-R E4-8 1
496,342,BYEIA EURK BF-R E4-8 4
497,342,BYEIA EURK BF-R E4-8 6
498,343,BYEIA EURK BF-R E4-9 1
499,344,BYEIA EURK DC-J B24-1 A 1
500,345,BYEIA EURK EF-A E18 5
501,346,BYEIA EURK FB-A C34 2 A
502,347,BYEIA EURK HA-A E17 3 E A
503,348,BYEIA EURK IP-X C2-2 A 2 A
504,348,BYEIA EURK IP-X C2-2 A 2 G
505,348,BYEIA EURK IP-X C2-2 B 1
506,349,BYEIA EURK JH-Y C23 2 A
507,350,BYEIA EURK JJ-M B10-0 B 1
508,351,BYEIA EURK KK-A D21 A 1
509,351,BYEIA EURK KK-A D21 A 2
510,351,BYEIA EURK KK-A D21 A 3
511,351,BYEIA EURK KK-A D21 A 4
512,352,BYEIA EURK KR-W E1-14 3
513,353,BYEIA EURK LM-O B38-0 B 1
514,354,BYEIA EURK OA-A D275 A 3 B
515,354,BYEIA EURK OA-A D275 A 3 C
516,354,BYEIA EURK OA-A D275 A 3 D
517,354,BYEIA EURK OA-A D275 A 3 G
518,354,BYEIA EURK OA-A D275 A 4 A
519,354,BYEIA EURK OA-A D275 A 5 A
520,354,BYEIA EURK OA-A D275 A 6 A
521,355,BYEIA EURK RS-S D4-8 B 2
522,356,BYEIA EURK UJ-Z B33-0 A 1
523,357,BYEIA EURK UN-S D4-4 4
524,358,BYEIA TRAA BD-C C13-0 A 1
525,359,BYEIA TRAA EQ-W C15-0 2 C
526,360,BYEIA TRAA KH-M D7-1 1
527,361,BYEIA TRAA KQ-P D5-3 A 1
528,362,BYOI AIN EH-P B47-105 6 A
529,363,BYOI AIN HW-W F1-210 DE 1
530,364,BYOI AIN NJ-K B50-35 A 10 A
531,365,BYOI AIN UW-J C22-992 A 1
532,366,BYOI AIN WE-R E4-913 2 B
533,366,BYOI AIN WE-R E4-913 3 E
534,367,BYOI AIP VA-E D12-143 4 B
535,368,BYOI THUA BU-R D4-32 AB 7 A A
536,369,BYOI THUA FY-F D12-0 4 D A
537,370,BYOI THUA JI-J D9-9 2 E A
538,371,BYOO BRE KS-S D4-0 C 3
539,372,BYOOE CHRAEA JL-P D5-1 B 2 A
540,373,BYOOMAO FU-G C27-300 4 B
541,374,BYOOMAO KV-E C28-5973 1 A
542,375,BYOOMAO LD-H D11-431 C 3 A
543,376,BYOOMAO WX-T C19-4064 2
544,377,BYOOMAO WX-T C19-7496 3
545,378,BYOOMEAE NY-R E4-4985 5
546,379,BYOOMI LT-O D7-4801 6 B
547,379,BYOOMI LT-O D7-4801 7 A
548,379,BYOOMI LT-O D7-4801 8 C
549,380,BYUA AIM HY-F D12-1322 3 C A
550,381,BYUA AIM MX-K D8-4056 1 B
551,382,BYUA AIM TE-W C16-130 3 D A
552,383,BYUA AOWSY YR-W C1-1 B 1
553,384,BYUA AUB CA-A E0 2
554,385,BYUA AUB UE-R C4-1 AB 3 A
555,386,BYUA AUB WO-K B36-0 3 A
556,387,BYUA EUQ AH-A C15-1 A 1
557,388,BYUA EUQ BQ-G D10-321 7 C A
558,389,BYUA EUQ CX-O B8-2 2 D
559,390,BYUA EUQ DV-N B7-8 1 A
560,391,BYUA EUQ EG-Y E41 B 3 A
561,391,BYUA EUQ EG-Y E41 B 3 B
562,392,BYUA EUQ GW-E D11-333 A 1
563,392,BYUA EUQ GW-E D11-333 A 3
564,393,BYUA EUQ KQ-P D5-70 A 4 A
565,394,BYUA EUQ RD-K D8-53 A 1
566,395,CALIFORNIA SECTOR BA-A E6 4
567,396,CALIFORNIA SECTOR DL-Y D25 1
568,397,CALIFORNIA SECTOR DL-Y D4 C 2
569,397,CALIFORNIA SECTOR DL-Y D4 C 3
570,397,CALIFORNIA SECTOR DL-Y D4 C 4
571,397,CALIFORNIA SECTOR DL-Y D4 C 5
572,397,CALIFORNIA SECTOR DL-Y D4 C 6
573,398,CALIFORNIA SECTOR HR-W D1-28 2
574,399,CALIFORNIA SECTOR JH-V C2-12 6
575,400,CALIFORNIA SECTOR LC-V C2-10 A 3
576,400,CALIFORNIA SECTOR LC-V C2-10 A 4
577,400,CALIFORNIA SECTOR LC-V C2-10 A 5
578,400,CALIFORNIA SECTOR LC-V C2-10 A 6
579,400,CALIFORNIA SECTOR LC-V C2-10 A 7
580,400,CALIFORNIA SECTOR LC-V C2-10 B 1
581,401,CAT'S PAW SECTOR FW-W D1-138 A 4 D
582,402,CAT'S PAW SECTOR HR-W D1-240 6 C
583,402,CAT'S PAW SECTOR HR-W D1-240 6 C A
584,403,CAT'S PAW SECTOR LS-T B3-5 1
585,404,CAT'S PAW SECTOR SY-R B4-10 A 2
586,405,CAVE SECTOR FB-X C1-3 1 A
587,406,CAVE SECTOR JH-V C2-8 A 1 A
588,407,CAVE SECTOR PN-T C3-2 1
589,408,CD-24 13810 A 4
590,409,CD-24 13823D 6 A
591,410,CD-24 13844 B 3
592,411,CD-26 1339 A 7 A
593,411,CD-26 1339 B 1 A A
594,412,CD-39 6137 2
595,413,CD-41 11037 10 B A
596,414,CD-51 10820 3 A
597,415,CD-58 4207 6 A
598,416,CEECKAEA UL-J D10-1 5
599,417,CEECKIA CC-K C25-0 ABCD 1 F
600,417,CEECKIA CC-K C25-0 ABCD 1 G
601,418,CEECKIA LD-F B45-0 1
602,419,CEECKIA OO-X D2-6 C 1
603,420,CEECKIA RA-U D4-1 6 A
604,421,CEECKIA YM-H D11-0 B 1
605,422,CEECKIA YQ-L C24-0 3 A
606,423,CENNICENINO 10 A A
607,424,CEPHEI SECTOR NX-U B2-0 B 5
608,425,CHAEA THAA EV-G D10-0 C 1
609,426,CHAEA THUA ZP-F C11-1 B 1
610,426,CHAEA THUA ZP-F C11-1 B 3
611,426,CHAEA THUA ZP-F C11-1 B 5
612,426,CHAEA THUA ZP-F C11-1 C 1
613,426,CHAEA THUA ZP-F C11-1 C 2
614,427,CHALOA UU-X D1-0 4 A
615,428,CHALUIA EK-B C15-0 5 B
616,429,CHARICK DRIFT A
617,430,CHEAE EUQ ER-L C21-0 3 A
618,431,CHEIA DRYE HK-G C27-0 A 4 A
619,431,CHEIA DRYE HK-G C27-0 A 4 B
620,432,CHEIA EOHN AQ-V D3-2 3
621,433,CHEIA EOHN AW-T D4-5 7
622,434,CHEIA EOHN PL-W C18-0 1
623,435,CHEIA EOHN VP-N C23-0 4 A
624,436,CHI HYDRAE A 10 A
625,436,CHI HYDRAE A 10 C A
626,436,CHI HYDRAE A 4 A
627,436,CHI HYDRAE A 5
628,436,CHI HYDRAE A 7
629,436,CHI HYDRAE A 8 B A
630,436,CHI HYDRAE A 9 A
631,436,CHI HYDRAE A 9 B
632,437,CHI PERSEI SECTOR IX-S D4-57 9 B A
633,438,CHO EUR OM-W D1-15 B 1
634,439,CHOKI A 1
635,440,CHONA 1
636,441,CHRAISAO FF-A D12 8 E A
637,442,CHRAISOAE HC-M D7-14 B 4 A
638,442,CHRAISOAE HC-M D7-14 B 4 B
639,443,CHRAISOU AK-R D4-41 AB 1 A
640,444,CHRAISUAE NF-Q C5-1 2 B
641,445,CHRAISUAE UD-T D3-1 5 A
642,446,CHRAUFAO AX-R C18-9 3 A
643,447,CHRAUFAO IF-R D4-103 2
644,448,CHRAUFAO IG-U C17-3 2 A
645,448,CHRAUFAO IG-U C17-3 2 B
646,448,CHRAUFAO IG-U C17-3 3 C
647,448,CHRAUFAO IG-U C17-3 6 A A
648,449,CHRAUFAO KL-P D5-12 9 D A
649,450,CHRAUFAO MP-M D8-4 ABC 7 A
650,451,CHRAUFAO OS-J C9-4 2 B A
651,452,CHRAUFAO PZ-C B15-0 4 A
652,453,CHRAUFAO RN-T D3-14 7 A A
653,454,CHRAUFAO RX-L B21-2 2
654,455,CHRAUFAO RX-L B21-3 2 A
655,456,CHRAUFAO RX-L D7-2 A 7
656,457,CHRAUFAO RX-L D7-36 1
657,458,CHRAUFAO RX-L D7-4 1 A
658,459,CHRAUFAO RX-L D7-8 ABC 2 A
659,460,CHRAUFAO RX-L D7-98 1
660,461,CHRAUFAO SY-R D4-1 3 A
661,462,CHRAUFAO VB-U B30-6 A 1
662,463,CHRAUFAO VJ-Y D1-0 A 3
663,464,CHRAUFAO ZO-R C20-1 AB 4 E A
664,465,CHREETAA PP-B B0 4 B
665,466,CHUA DRYIAE NE-C C2-0 A 1
666,466,CHUA DRYIAE NE-C C2-0 A 1 A
667,467,CHUA EOP ZC-T C20-0 2 A
668,468,CL PISMIS 17 7 B A
669,469,CL PISMIS 19 A 1
670,470,CL PISMIS 3 CD 1 A
671,470,CL PISMIS 3 CD 1 B
672,470,CL PISMIS 3 CD 2 A
673,470,CL PISMIS 3 CD 2 C
674,470,CL PISMIS 3 CD 2 D
675,470,CL PISMIS 3 CD 2 E
676,470,CL PISMIS 3 CD 5
677,471,CLIEWOAE RZ-D D13-0 AB 3 A
678,472,CLOOKEOU AK-B B58-11 D 4
679,473,CLOOKEOU CH-B D14-147 2 B
680,473,CLOOKEOU CH-B D14-147 2 F A
681,474,CLOOKEOU NE-D B56-4 B 1 A
682,475,CLOOKEOU RF-D D13-84 2 A
683,476,CLOOKEOU UT-I C25-22 A 1 A
684,477,CLOOKEOU VL-B D14-114 2 A
685,478,CLOOKEOU VL-B D14-121 ABCD 1 A A
686,479,CLOOKOU TS-S D4-45 AB 1
687,479,CLOOKOU TS-S D4-45 AB 3
688,480,CLOOKU AL-G B56-16 3 A
689,480,CLOOKU AL-G B56-16 3 C
690,480,CLOOKU AL-G B56-16 3 D
691,480,CLOOKU AL-G B56-16 3 E
692,480,CLOOKU AL-G B56-16 4 A
693,480,CLOOKU AL-G B56-16 6 A A
694,480,CLOOKU AL-G B56-16 6 B A
695,481,CLOOKU BA-A G30 B 11 A
696,482,CLOOKU BC-O C9-252 B 1
697,482,CLOOKU BC-O C9-252 B 4 A
698,482,CLOOKU BC-O C9-252 B 4 B
699,482,CLOOKU BC-O C9-252 B 4 C
700,483,CLOOKU CL-A C3-1151 A 3 B
701,483,CLOOKU CL-A C3-1151 A 3 C
702,484,CLOOKU CL-A C3-80 1 A
703,484,CLOOKU CL-A C3-80 3 A
704,485,CLOOKU DI-V B22-105 1 A
705,485,CLOOKU DI-V B22-105 1 B
706,485,CLOOKU DI-V B22-105 1 C
707,485,CLOOKU DI-V B22-105 2 A
708,485,CLOOKU DI-V B22-105 2 B
709,485,CLOOKU DI-V B22-105 2 C
710,486,CLOOKU DX-I D10-255 2 B
711,487,CLOOKU EW-Y C3-197 2
712,487,CLOOKU EW-Y C3-197 5 G A
713,488,CLOOKU FH-S D5-2026 2
714,488,CLOOKU FH-S D5-2026 2 A
715,488,CLOOKU FH-S D5-2026 3
716,488,CLOOKU FH-S D5-2026 3 A
717,488,CLOOKU FH-S D5-2026 4
718,488,CLOOKU FH-S D5-2026 7 A
719,488,CLOOKU FH-S D5-2026 7 C
720,489,CLOOKU HJ-L B14-111 5 G A
721,490,CLOOKU ID-O B25-7 AB 1
722,491,CLOOKU IH-S D5-134 1 A
723,491,CLOOKU IH-S D5-134 3 A
724,491,CLOOKU IH-S D5-134 3 B
725,491,CLOOKU IH-S D5-134 4 A
726,491,CLOOKU IH-S D5-134 4 B
727,492,CLOOKU KF-Y C17-1298 4 A
728,492,CLOOKU KF-Y C17-1298 4 D
729,492,CLOOKU KF-Y C17-1298 4 E
730,493,CLOOKU KM-L D8-274 C 5 A
731,494,CLOOKU KO-P B39-117 2 A
732,494,CLOOKU KO-P B39-117 2 B
733,494,CLOOKU KO-P B39-117 2 C
734,494,CLOOKU KO-P B39-117 3 A
735,494,CLOOKU KO-P B39-117 3 B
736,494,CLOOKU KO-P B39-117 3 C
737,494,CLOOKU KO-P B39-117 3 G
738,494,CLOOKU KO-P B39-117 3 H
739,495,CLOOKU LN-X B7-124 1 A
740,495,CLOOKU LN-X B7-124 1 D A
741,496,CLOOKU MC-V E2-412 2
742,497,CLOOKU ME-G B44-98 3 B A
743,497,CLOOKU ME-G B44-98 3 D A
744,497,CLOOKU ME-G B44-98 4 B
745,497,CLOOKU ME-G B44-98 4 C
746,498,CLOOKU MM-C D43 3 A A
747,499,CLOOKU OY-V B8-125 3 A
748,500,CLOOKU PN-J D9-12 3 B
749,501,CLOOKU RB-N C23-206 AB 2 A
750,501,CLOOKU RB-N C23-206 AB 3 A
751,501,CLOOKU RB-N C23-206 AB 3 B
752,501,CLOOKU RB-N C23-206 AB 3 C
753,501,CLOOKU RB-N C23-206 B 1
754,501,CLOOKU RB-N C23-206 B 4 A
755,502,CLOOKU RJ-T C6-562 2 A
756,502,CLOOKU RJ-T C6-562 4 B A
757,502,CLOOKU RJ-T C6-562 5 A
758,502,CLOOKU RJ-T C6-562 5 B
759,503,CLOOKU RM-M C23-223 A 1 A
760,504,CLOOKU SI-B E544 1
761,505,CLOOKU UK-S B10-67 2 A
762,505,CLOOKU UK-S B10-67 2 B
763,506,CLOOKU UP-J C24-226 2 B
764,506,CLOOKU UP-J C24-226 2 C
765,507,CLOOKU UZ-E D12-45 2
766,508,CLOOKU WU-V D3-754 3
767,509,CLOOKU WZ-M B12-26 1
768,510,CLOOKU XQ-Q B11-176 B 1
769,511,CLOOKU YC-V B22-53 B 2 A
770,512,CLOOKU YJ-Z E313 B 2
771,513,CLOOKU ZE-E B4-111 1 A A
772,514,CLOOKUIA AW-V B16-0 B 3 A
