id,system,bodyName
1,1,10 ARIETIS A 1
2,2,102 IOTA TAURI B 2 A
3,3,139 TAURI A 2 A
4,3,139 TAURI A 2 B
5,3,139 TAURI A 5
6,3,139 TAURI B 1
7,4,16 H ORIONIS ABC 2 C A
8,5,164 G. CANIS MAJORIS 5 C A
9,6,2MASS J10433563-5945136 1 A
10,6,2MASS J10433563-5945136 2 A
11,6,2MASS J10433563-5945136 2 B
12,7,2MASS J10433739-6005084 B 1 A
13,7,2MASS J10433739-6005084 B 2 D
14,8,2MASS J10444160-5947046 1 B
15,8,2MASS J10444160-5947046 2 B A
16,9,2MASS J14272268-5940166 C 1
17,9,2MASS J14272268-5940166 C 2
18,10,2MASS J14274501-5937518 A 5
19,10,2MASS J14274501-5937518 A 6 A
20,10,2MASS J14274501-5937518 A 6 B
21,11,2MASS J18171704-1659394 A 1
22,12,2MASS J18175838-1702401 4
23,13,2MASS J18181264-1654135 1 A
24,14,2MASS J18182881-1649403 A 6 B
25,14,2MASS J18182881-1649403 A 6 C A
26,14,2MASS J18182881-1649403 A 7 A
27,14,2MASS J18182881-1649403 A 7 B
28,15,2MASS J18182894-1645056 A 1
29,16,2MASS J18183883-1645311 B 3
30,17,2MASS J18184271-1658059 2 A
31,17,2MASS J18184271-1658059 4 C A
32,18,2MASS J18185300-1638082 4
33,19,2MASS J18185936-1641019 4
34,20,2MASS J18191417-1629510 AB 6 A
35,21,2MASS J18192192-1630004 2 A
36,22,2MASS J18192265-1631091 5 A
37,23,2MASS J18192359-1632298 ABCD 5 A
38,24,2MASS J18194800-1644152 8 A
39,24,2MASS J18194800-1644152 8 B
40,25,2MASS J18202544-1636087 5 A
41,26,35 G. CARINAE 1 E
42,27,4 CAMELOPARDALIS 10 C A
43,28,5 PUPPIS B 1
44,29,57 HYDRAE 8
45,30,63 G. CAPRICORNI 4
46,31,64 ARIETIS 2
47,32,64 VIRGINIS 4 C
48,33,70 G. CARINAE 10 C
49,33,70 G. CARINAE 6 A
50,34,72 TAURI 1 C A
51,35,AEDGORN AG-O D6-2 A 1
52,35,AEDGORN AG-O D6-2 A 2 A
53,36,AEDGORN DL-P D5-0 A 1
54,37,AEDGORN XK-O D6-2 A 1
55,37,AEDGORN XK-O D6-2 ABC 4 A C
56,38,AGNAIMT YC-H D11-85 1
57,39,AIPHAIRDS FB-E D12-306 1
58,40,AIPHAISTY AB-O D6-159 B 4 A
59,41,AIPHAISTY LX-U E2-24 AB 2 C
60,42,AIPHAISTY XJ-A D55 3
61,43,ALAUNUS 10
62,44,ARIES DARK REGION AQ-Y D14 4 A
63,45,ARIES DARK REGION DB-X C1-2 B 1
64,46,ARIES DARK REGION DB-X C1-7 A 9 A
65,47,ARIES DARK REGION DB-X D1-63 A 7 A
66,48,ARIES DARK REGION DB-X D1-64 4 A
67,49,ARIES DARK REGION FW-W D1-59 A 5 A
68,50,ARIES DARK REGION FW-W D1-76 4 A
69,51,ARIES DARK REGION GW-W D1-48 6 A
70,52,ARIES DARK REGION GW-W D1-86 1 B
71,53,ARIES DARK REGION HR-W C1-1 8 C
72,54,ARIES DARK REGION HR-W D1-34 2 A
73,55,ARIES DARK REGION HR-W D1-44 B 2 A
74,56,ARIES DARK REGION HR-W D1-53 7 A
75,57,ARIES DARK REGION HR-W D1-54 2 C A
76,58,ARIES DARK REGION IH-V C2-9 6 B
77,59,ARIES DARK REGION IM-V C2-5 12 A
78,60,ARIES DARK REGION JC-V C2-6 A 4 A
79,61,ARIES DARK REGION JS-T C3-1 1 A
80,62,ARIES DARK REGION JW-W C1-4 7 A
81,63,ARIES DARK REGION KH-V C2-4 7 A
82,64,ARIES DARK REGION MS-T C3-15 1 A
83,65,ARIES DARK REGION MS-T C3-2 A 1 A
84,66,ARIES DARK REGION MS-T C3-8 A 9 A
85,66,ARIES DARK REGION MS-T C3-8 A 9 B
86,66,ARIES DARK REGION MS-T C3-8 A 9 C
87,66,ARIES DARK REGION MS-T C3-8 A 9 D
88,67,ARIES DARK REGION MX-U C2-10 1 C
89,68,ARIES DARK REGION MX-U C2-8 A 7 A
90,69,ARIES DARK REGION NN-T C3-12 1 D
91,70,ARIES DARK REGION OD-S B4-1 A 3
92,71,ARIES DARK REGION OI-T C3-8 1 A
93,72,ARIES DARK REGION PY-R B4-1 A 4 A
94,73,ARIES DARK REGION VT-R B4-0 A 6
95,74,ASSAIPY LD-K D8-71 2 B
96,75,ATHAIR YO-I D9-272 2 C A
97,76,ATHENA AB 1 E A
98,77,AUCOKS HC-U B33-0 3 B
99,78,AUSANTUATEL 1
100,79,BALIE A 1 C A
101,80,BARATI A 1
102,81,BATZ 2 A
103,81,BATZ 2 B
104,81,BATZ 2 C
105,81,BATZ 3 A
106,81,BATZ 4 A
107,82,BAULOO LX-U E2-17 D 14 B
108,83,BD-11 4932 1
109,84,BD-12 1172 1
110,84,BD-12 1172 10 A
111,84,BD-12 1172 10 B
112,84,BD-12 1172 2
113,84,BD-12 1172 4
114,84,BD-12 1172 5 A
115,84,BD-12 1172 7
116,85,BD+38 2037 A 1
117,86,BD+47 2936 2
118,87,BELAAKO AB 1 C A
119,88,BETA HYDRI 7 C
120,89,BHOTHO AB 1 A
121,90,BLA PHROEA HS-H D11-0 C 1
122,91,BLA PHROEA TK-C D14-0 1 A
123,91,BLA PHROEA TK-C D14-0 4 B
124,92,BLAA EAEC NL-L C9-136 B 5 A
125,93,BLAA EAEC UE-I B55-6 6 B
126,94,BLAA HYPAI CQ-X D1-21 1
127,95,BLAA HYPAI CZ-D C13-0 8 B
128,95,BLAA HYPAI CZ-D C13-0 8 C
129,96,BLAA HYPAI DD-I B26-0 B 4 A
130,97,BLAA HYPAI DZ-D C13-1 B 6 A
131,98,BLAA HYPAI EU-D C13-0 B 4
132,99,BLAA HYPAI GG-V C3-4 3
133,100,BLAA HYPAI HW-V D2-6 1 B
134,101,BLAA HYPAI HY-H B26-1 A 2
135,102,BLAA HYPAI LZ-F B27-0 A 2
136,102,BLAA HYPAI LZ-F B27-0 A 5
137,103,BLAA HYPAI OZ-O D6-0 5 A
138,104,BLAA HYPAI OZ-O D6-16 4 C
139,105,BLAA HYPAI UO-L B10-1 1 C
140,106,BLAA HYPAI XR-I B26-0 A 3
141,107,BLAA PHOE AA-A G2 C 1 A
142,108,BLAA PHOE GM-B C27-55 A 1
143,108,BLAA PHOE GM-B C27-55 A 2
144,109,BLAA PHOE HP-J C24-151 A 6 A
145,109,BLAA PHOE HP-J C24-151 ABC 1 A
146,109,BLAA PHOE HP-J C24-151 ABC 2 A
147,109,BLAA PHOE HP-J C24-151 ABC 2 B
148,109,BLAA PHOE HP-J C24-151 ABC 2 C
149,109,BLAA PHOE HP-J C24-151 ABC 2 D
150,109,BLAA PHOE HP-J C24-151 ABC 2 E
151,109,BLAA PHOE HP-J C24-151 ABC 3 D
152,109,BLAA PHOE HP-J C24-151 ABC 3 E
153,110,BLAA PHOE HW-D D12-156 1
154,111,BLAA PHOE IA-M B38-12 2 A
155,111,BLAA PHOE IA-M B38-12 2 B
156,111,BLAA PHOE IA-M B38-12 3 A
157,112,BLAA PHOE MN-E B53-11 2 A
158,113,BLAA PHOE NZ-Z C33 B 1 F
159,114,BLAA PHOE OR-V D2-174 1
160,115,BLAA PHOE QK-D D13-553 A 1
161,116,BLAA PHOE RE-E B55-16 A 1
162,117,BLAA PHOE RY-P B7-8 3 A
163,117,BLAA PHOE RY-P B7-8 3 A A
164,118,BLAA PHOE TI-B C29-242 3 A
165,119,BLAA PHOE VG-O B51-19 B 1
166,119,BLAA PHOE VG-O B51-19 B 3
167,120,BLAA PHOE XO-Q D5-241 A 2
168,121,BLAA PHOE YK-G B27-10 5 A
169,121,BLAA PHOE YK-G B27-10 5 B
170,121,BLAA PHOE YK-G B27-10 5 C
171,121,BLAA PHOE YK-G B27-10 6 A
172,121,BLAA PHOE YK-G B27-10 6 B
173,121,BLAA PHOE YK-G B27-10 6 C
174,122,BLAA PHOE YR-O C21-23 1 A
175,122,BLAA PHOE YR-O C21-23 4 A
176,122,BLAA PHOE YR-O C21-23 4 B
177,122,BLAA PHOE YR-O C21-23 4 C
178,122,BLAA PHOE YR-O C21-23 5 A
179,123,BLAE DRYE DF-I B57-6 1
180,124,BLAE DRYE PE-E D13-6 4 A
181,124,BLAE DRYE PE-E D13-6 4 B
182,125,BLAE DRYE PP-A C29-7 3 C
183,126,BLAE DRYE QZ-D D13-103 6 B
184,127,BLAE DRYE SM-Y B58-0 A 2
185,127,BLAE DRYE SM-Y B58-0 A 3
186,127,BLAE DRYE SM-Y B58-0 B 1
187,128,BLAE DRYE TK-C D14-37 ABC 2 A
188,129,BLAE DRYE VM-G B58-13 D 1
189,129,BLAE DRYE VM-G B58-13 D 2
190,129,BLAE DRYE VM-G B58-13 D 3
191,130,BLAE DRYE WU-O E6-3 B 1
192,131,BLAE DRYE XU-O E6-22 2
193,132,BLAE DRYE YV-B D14-25 3
194,133,BLAE EORK IF-G C27-13 A 1
195,134,BLAE EORK QU-D D13-3 3
196,135,BLAE EORK RK-C D14-15 7 A
197,135,BLAE EORK RK-C D14-15 8 C
198,136,BLAE EORK RU-D D13-17 1 A
199,137,BLAE EORK RU-D D13-20 5 A
200,137,BLAE EORK RU-D D13-20 5 D
201,137,BLAE EORK RU-D D13-20 7 A
202,138,BLAE EORK UL-J B56-1 A 2
203,138,BLAE EORK UL-J B56-1 A 3
204,139,BLAE HYPUE SW-E B28-1 1 B
205,140,BLAU AED GW-T D4-9 A 4 B A
206,141,BLEAE AEWSY GV-X D1-27 3 B
207,142,BLEAE AEWSY LE-M B10-1 A 2
208,143,BLEAE EURK FG-Y G2 A 1
209,144,BLEAE THAA NZ-C C1-0 A 2 D
210,145,BLEAE THUA BI-D C12-5 7 A
211,146,BLEAE THUA CA-L C10-1 1
212,146,BLEAE THUA CA-L C10-1 4
213,146,BLEAE THUA CA-L C10-1 6 B
214,146,BLEAE THUA CA-L C10-1 6 G
215,146,BLEAE THUA CA-L C10-1 7 D A
216,147,BLEAE THUA HK-Z D5 7 C
217,148,BLEAE THUA HL-E B13-1 5 B
218,149,BLEAE THUA ME-U B44-0 2
219,150,BLEAE THUA NZ-G B55-0 2 E
220,151,BLEAE THUA VW-N C6-13 A 1 A
221,151,BLEAE THUA VW-N C6-13 A 1 D
222,152,BLEAE THUA XF-A C15 3 A
223,153,BLEAE THUA XY-S D3-41 A 5
224,154,BLEAE THUA ZW-A C27-15 3 B
225,155,BLEETHOAE CM-C D13-208 7 A
226,156,BLEETHU TY-W C16-4 B 1 A
227,157,BLEIA DRYIAE AC-S D5-114 C 1
228,158,BLEIA DRYIAE EK-C D14-102 1 A
229,158,BLEIA DRYIAE EK-C D14-102 1 B
230,158,BLEIA DRYIAE EK-C D14-102 1 C
231,158,BLEIA DRYIAE EK-C D14-102 2 C
232,158,BLEIA DRYIAE EK-C D14-102 3 A
233,158,BLEIA DRYIAE EK-C D14-102 3 B
234,158,BLEIA DRYIAE EK-C D14-102 3 C
235,158,BLEIA DRYIAE EK-C D14-102 3 D
236,158,BLEIA DRYIAE EK-C D14-102 4 A
237,159,BLEIA DRYIAE EK-C D14-18 4 A
238,160,BLEIA DRYIAE EO-W B35-0 A 1
239,161,BLEIA DRYIAE HN-S E4-37 B 1
240,162,BLEIA DRYIAE IH-K C25-36 C 2
241,163,BLEIA DRYIAE II-I C26-20 2 A
242,164,BLEIA DRYIAE MA-M B54-8 B 1 A
243,165,BLEIA DRYIAE NF-C D14-89 C 1
244,166,BLEIA DRYIAE UP-F B44-1 C 1
245,167,BLEIA DRYIAE WF-L D9-176 4
246,168,BLEIA DRYIAE ZQ-E B59-8 A 6
247,168,BLEIA DRYIAE ZQ-E B59-8 B 1
248,168,BLEIA DRYIAE ZQ-E B59-8 B 2
249,169,BLEIA EOHN LM-Y C3-13 6 A
250,170,BLEIA EOHN TK-C C27-0 A 3
251,170,BLEIA EOHN TK-C C27-0 A 4 A
252,170,BLEIA EOHN TK-C C27-0 A 4 D
253,170,BLEIA EOHN TK-C C27-0 A 5 A
254,171,BLIE AICK BA-A G0 B 1 A
255,172,BLIE AICK LR-W E1-3 3
256,172,BLIE AICK LR-W E1-3 5
257,173,BLIE AICK VA-Z C11 B 2 B
258,174,BLIE PHLA VP-B C28-2 7 A
259,175,BLO AESCS KN-S E4-361 ABCD 2
260,175,BLO AESCS KN-S E4-361 ABCD 4
261,176,BLO AESCS RR-U C19-18 4 A
262,177,BLO AESCS UL-L B41-1 C 4 A
263,178,BLO AESCS YY-A D80 1 C A
264,179,BLO AIRM CB-W E2-0 1
265,180,BLODES A 2
266,181,BLU EUQ BM-C D13-24 AB 1 A
267,181,BLU EUQ BM-C D13-24 ABC 1 C A
268,182,BLU EUQ IP-K B10-0 B 2
269,183,BLU THUA AE-T B3-5 1
270,183,BLU THUA AE-T B3-5 5 A
271,184,BLU THUA AI-A C14-10 A 4 A
272,185,BLU THUA BR-U C16-0 A 2 A
273,186,BLU THUA EM-K B22-2 AB 1 A
274,186,BLU THUA EM-K B22-2 ABC 2 A
275,187,BLU THUA EW-T B17-5 3 A
276,188,BLU THUA GB-O C6-9 C 1
277,189,BLU THUA GI-B B55-2 4 A
278,190,BLU THUA HR-N D6-60 A 5 A
279,191,BLU THUA JS-M B35-2 3
280,192,BLU THUA KF-K B36-1 1
281,193,BLU THUA LF-M C21-11 A 1
282,194,BLU THUA MA-W B29-3 A 9 A
283,195,BLU THUA NL-F B11-5 A 4 A
284,195,BLU THUA NL-F B11-5 A 4 B
285,196,BLU THUA NN-J B9-2 A 6 C
286,197,BLU THUA OO-X D2-1 1 A
287,198,BLU THUA TS-X C28-6 3
288,199,BLUA EAEC AG-X E1-2095 7
289,200,BLUA EAEC AN-E C14-357 5 A
290,201,BLUA EAEC AN-E C14-41 1 A
291,202,BLUA EAEC BX-G C12-26 C 3 A
292,203,BLUA EAEC EW-V E2-3175 6 A
293,204,BLUA EAEC EW-V E2-3617 AB 11 A
294,204,BLUA EAEC EW-V E2-3617 AB 11 H A
295,204,BLUA EAEC EW-V E2-3617 AB 11 J
296,205,BLUA EAEC EW-V E2-4218 7
297,206,BLUA EAEC IC-U E3-902 A 1
298,206,BLUA EAEC IC-U E3-902 A 3
299,206,BLUA EAEC IC-U E3-902 A 4
300,207,BLUA EAEC KT-F D12-830 2
301,208,BLUA EAEC LD-Q D6-1538 AB 1 A
302,208,BLUA EAEC LD-Q D6-1538 B 4
303,209,BLUA EAEC LK-W B6-21 8 B
304,210,BLUA EAEC MM-M C23-188 BC 1 A
305,211,BLUA EAEC PJ-O D7-1262 8 D
306,212,BLUA EAEC ST-Y D1-517 1 A
307,213,BLUA EAEC WG-G C13-307 7 D
308,214,BLUA HYPUE JX-R D5-242 3
309,215,BLUA HYPUE OF-E D12-87 B 2 A
310,216,BLUA HYPUE OV-C D13-210 3
311,217,BLUE PHROEA EK-C D14-0 C 1
312,218,BLUE PHROEA EY-G D11-0 B 2
313,219,BOEKH UM-O C8-64 2 G A
314,220,BOELTS YK-X E1-626 5
315,221,BOELTS ZH-U C19-468 3
316,222,BOEPH FU-B C2-8 4 A
317,223,BOEPH TT-H D10-1451 4
318,224,BOEPP XA-D D13-2289 B 8 E
319,225,BOEPP XA-D D13-2791 7 D
320,226,BOEPP ZK-O E6-226 15 C A
321,227,BOEPPY XZ-X D1-13 6 A
322,228,BOERTH BT-Q B9-47 7 C
323,229,BOERTH FN-H D11-3298 3 A
324,230,BOETZ TL-U B20-0 3 C
325,231,BOEWNST CB-W C18-748 A 4 A
326,231,BOEWNST CB-W C18-748 B 4
327,232,BOEWNST CT-F D12-2430 1 A
328,233,BOEWNST CV-P D5-631 CD 1
329,234,BOEWNST DH-U E3-8179 A 1
330,235,BOEWNST EM-E B2-34 B 2 A
331,235,BOEWNST EM-E B2-34 B 3 A
332,235,BOEWNST EM-E B2-34 B 4 A
333,235,BOEWNST EM-E B2-34 B 4 B
334,235,BOEWNST EM-E B2-34 B 4 C
335,235,BOEWNST EM-E B2-34 B 5 A
336,235,BOEWNST EM-E B2-34 B 6 A
337,235,BOEWNST EM-E B2-34 B 6 B
338,236,BOEWNST ES-H B43-30 5 E
339,237,BOEWNST FO-F D12-4094 1
340,237,BOEWNST FO-F D12-4094 2
341,237,BOEWNST FO-F D12-4094 3
342,237,BOEWNST FO-F D12-4094 4
343,237,BOEWNST FO-F D12-4094 6
344,237,BOEWNST FO-F D12-4094 7
345,238,BOEWNST GM-U C19-2109 B 7
346,239,BOEWNST HN-S E4-325 A 6 D A
347,240,BOEWNST JS-J C25-1327 7 A
348,241,BOEWNST KJ-O D7-2934 AB 2
349,242,BOEWNST KS-S C20-959 A 2 A
350,243,BOEWNST KS-S C20-969 2 A
351,244,BOEWNST LO-Z B4-20 1 A
352,244,BOEWNST LO-Z B4-20 1 B
353,244,BOEWNST LO-Z B4-20 1 D
354,244,BOEWNST LO-Z B4-20 1 E
355,244,BOEWNST LO-Z B4-20 2 A
356,244,BOEWNST LO-Z B4-20 2 B
357,245,BOEWNST LU-D D13-5628 B 1
358,245,BOEWNST LU-D D13-5628 B 2
359,245,BOEWNST LU-D D13-5628 B 3
360,246,BOEWNST LU-M D8-3748 A 1 D
361,247,BOEWNST MC-L C24-418 3 A
362,247,BOEWNST MC-L C24-418 3 B
363,247,BOEWNST MC-L C24-418 4 A
364,247,BOEWNST MC-L C24-418 4 B
365,248,BOEWNST MN-S C20-117 B 1
366,248,BOEWNST MN-S C20-117 B 1 A
367,249,BOEWNST NE-O D7-1394 1
368,250,BOEWNST NG-G C13-2 2
369,250,BOEWNST NG-G C13-2 3
370,250,BOEWNST NG-G C13-2 3 A
371,250,BOEWNST NG-G C13-2 3 B
372,251,BOEWNST OA-L D9-1285 B 3 A
373,251,BOEWNST OA-L D9-1285 B 4
374,251,BOEWNST OA-L D9-1285 B 4 A
375,252,BOEWNST OA-L D9-3853 3 A
376,253,BOEWNST OA-L D9-4513 2
377,254,BOEWNST PA-L D9-4002 B 5
378,254,BOEWNST PA-L D9-4002 B 7 A
379,255,BOEWNST PT-Q C21-905 A 3 A
380,256,BOEWNST RE-G C27-1075 A 1
381,257,BOEWNST RL-J D10-1594 6 A
382,258,BOEWNST SV-B D14-928 A 1
383,258,BOEWNST SV-B D14-928 B 4 A
384,259,BOEWNST TG-J D10-1066 3 A
385,260,BOEWNST TG-J D10-1093 1 A
386,261,BOEWNST TG-J D10-488 6 A
387,261,BOEWNST TG-J D10-488 6 A A
388,262,BOEWNST TG-J D10-5134 6 A
389,263,BOEWNST TZ-M B40-241 1
390,264,BOEWNST WK-L C9-4 3 C
391,265,BOEWNST ZF-E C12-104 A 1
392,266,BOEWNST ZJ-R D4-26 A 2 A
393,267,BRESTLA A 14 C A
394,268,BUBBLE SECTOR LX-T B3-1 1 A
395,269,BUZHANG KU 3 B
396,270,BYA AIL TY-S E3-276 1
397,271,BYAA AIN QA-J C11-144 4
398,272,BYAA AIN YO-Z D1902 A 2 B
399,273,BYAA AIN YP-V D3-295 B 2 B
400,274,BYAA AIN YP-V D3-654 1 A
401,274,BYAA AIN YP-V D3-654 1 C
402,274,BYAA AIN YP-V D3-654 1 C A
403,274,BYAA AIN YP-V D3-654 1 D
404,274,BYAA AIN YP-V D3-654 1 E
405,275,BYAA FLEE MT-N C21-0 C 3 A
406,275,BYAA FLEE MT-N C21-0 D 1
407,276,BYAA THEIA WO-R E4-3 A 3
408,277,BYAE AIRG EE-B C39 AB 3 A
409,278,BYAE AOWSY GR-N D6-52 4 D A
410,279,BYEIA EUQ OG-Y D221 A 1 C
411,280,BYEIA EUR BA-A G3 1
412,281,BYEIA EURK AS-J C22-43 2
413,282,BYEIA EURK BF-R E4-32 1
414,282,BYEIA EURK BF-R E4-32 5
415,283,BYEIA EURK BF-R E4-7 8 B A
416,283,BYEIA EURK BF-R E4-7 8 C A
417,284,BYEIA EURK BF-R E4-8 1
418,284,BYEIA EURK BF-R E4-8 4
419,284,BYEIA EURK BF-R E4-8 6
420,285,BYEIA EURK BF-R E4-9 1
421,286,BYEIA EURK DC-J B24-1 A 1
422,287,BYEIA EURK EF-A E18 5
423,288,BYEIA EURK FB-A C34 2 A
424,289,BYEIA EURK HA-A E17 3 E A
425,290,BYEIA EURK IP-X C2-2 A 2 A
426,290,BYEIA EURK IP-X C2-2 A 2 G
427,290,BYEIA EURK IP-X C2-2 B 1
428,291,BYEIA EURK JH-Y C23 2 A
429,292,BYEIA EURK JJ-M B10-0 B 1
430,293,BYEIA EURK KK-A D21 A 1
431,293,BYEIA EURK KK-A D21 A 2
432,293,BYEIA EURK KK-A D21 A 3
433,293,BYEIA EURK KK-A D21 A 4
434,294,BYEIA EURK KR-W E1-14 3
435,295,BYEIA EURK LM-O B38-0 B 1
436,296,BYEIA EURK OA-A D275 A 3 B
437,296,BYEIA EURK OA-A D275 A 3 C
438,296,BYEIA EURK OA-A D275 A 3 D
439,296,BYEIA EURK OA-A D275 A 3 G
440,296,BYEIA EURK OA-A D275 A 4 A
441,296,BYEIA EURK OA-A D275 A 5 A
442,296,BYEIA EURK OA-A D275 A 6 A
443,297,BYEIA EURK RS-S D4-8 B 2
444,298,BYEIA EURK UJ-Z B33-0 A 1
445,299,BYEIA EURK UN-S D4-4 4
446,300,BYEIA TRAA BD-C C13-0 A 1
447,301,BYEIA TRAA EQ-W C15-0 2 C
448,302,BYEIA TRAA KH-M D7-1 1
449,303,BYEIA TRAA KQ-P D5-3 A 1
450,304,BYOI AIN EH-P B47-105 6 A
451,305,BYOI AIN HW-W F1-210 DE 1
452,306,BYOI AIN NJ-K B50-35 A 10 A
453,307,BYOI AIN UW-J C22-992 A 1
454,308,BYOI AIN WE-R E4-913 2 B
455,308,BYOI AIN WE-R E4-913 3 E
456,309,BYOI AIP VA-E D12-143 4 B
457,310,BYOI THUA BU-R D4-32 AB 7 A A
458,311,BYOI THUA FY-F D12-0 4 D A
459,312,BYOI THUA JI-J D9-9 2 E A
460,313,BYOO BRE KS-S D4-0 C 3
461,314,BYOOE CHRAEA JL-P D5-1 B 2 A
462,315,BYOOMAO FU-G C27-300 4 B
463,316,BYOOMI LT-O D7-4801 6 B
464,316,BYOOMI LT-O D7-4801 7 A
465,316,BYOOMI LT-O D7-4801 8 C
466,317,BYUA AIM HY-F D12-1322 3 C A
467,318,BYUA AIM MX-K D8-4056 1 B
468,319,BYUA AIM TE-W C16-130 3 D A
469,320,BYUA EUQ AH-A C15-1 A 1
470,321,BYUA EUQ BQ-G D10-321 7 C A
471,322,BYUA EUQ CX-O B8-2 2 D
472,323,BYUA EUQ DV-N B7-8 1 A
473,324,BYUA EUQ EG-Y E41 B 3 A
474,324,BYUA EUQ EG-Y E41 B 3 B
475,325,BYUA EUQ GW-E D11-333 A 1
476,325,BYUA EUQ GW-E D11-333 A 3
477,326,BYUA EUQ KQ-P D5-70 A 4 A
478,327,BYUA EUQ RD-K D8-53 A 1
479,328,CALIFORNIA SECTOR BA-A E6 4
480,329,CALIFORNIA SECTOR DL-Y D25 1
481,330,CALIFORNIA SECTOR DL-Y D4 C 2
482,330,CALIFORNIA SECTOR DL-Y D4 C 3
483,330,CALIFORNIA SECTOR DL-Y D4 C 4
484,330,CALIFORNIA SECTOR DL-Y D4 C 5
485,330,CALIFORNIA SECTOR DL-Y D4 C 6
486,331,CALIFORNIA SECTOR HR-W D1-28 2
487,332,CALIFORNIA SECTOR JH-V C2-12 6
488,333,CALIFORNIA SECTOR LC-V C2-10 A 3
489,333,CALIFORNIA SECTOR LC-V C2-10 A 4
490,333,CALIFORNIA SECTOR LC-V C2-10 A 5
491,333,CALIFORNIA SECTOR LC-V C2-10 A 6
492,333,CALIFORNIA SECTOR LC-V C2-10 A 7
493,333,CALIFORNIA SECTOR LC-V C2-10 B 1
494,334,CAT'S PAW SECTOR FW-W D1-138 A 4 D
495,335,CAT'S PAW SECTOR HR-W D1-240 6 C
496,335,CAT'S PAW SECTOR HR-W D1-240 6 C A
497,336,CAT'S PAW SECTOR LS-T B3-5 1
498,337,CAVE SECTOR FB-X C1-3 1 A
499,338,CAVE SECTOR JH-V C2-8 A 1 A
500,339,CD-24 13810 A 4
501,340,CD-24 13823D 6 A
502,341,CD-24 13844 B 3
503,342,CD-26 1339 B 1 A A
504,343,CD-39 6137 2
505,344,CD-41 11037 10 B A
506,345,CD-51 10820 3 A
507,346,CEPHEI SECTOR NX-U B2-0 B 5
508,347,CHAEA THAA EV-G D10-0 C 1
509,348,CHAEA THUA ZP-F C11-1 B 1
510,348,CHAEA THUA ZP-F C11-1 B 3
511,348,CHAEA THUA ZP-F C11-1 B 5
512,348,CHAEA THUA ZP-F C11-1 C 1
513,348,CHAEA THUA ZP-F C11-1 C 2
514,349,CHALOA UU-X D1-0 4 A
515,350,CHALUIA EK-B C15-0 5 B
516,351,CHARICK DRIFT A
517,352,CHI HYDRAE A 10 A
518,352,CHI HYDRAE A 10 C A
519,352,CHI HYDRAE A 4 A
520,352,CHI HYDRAE A 5
521,352,CHI HYDRAE A 7
522,352,CHI HYDRAE A 8 B A
523,352,CHI HYDRAE A 9 A
524,352,CHI HYDRAE A 9 B
525,353,CHI PERSEI SECTOR IX-S D4-57 9 B A
526,354,CHO EUR OM-W D1-15 B 1
527,355,CHONA 1
528,356,CHRAISAO FF-A D12 8 E A
529,357,CHRAISOAE HC-M D7-14 B 4 A
530,357,CHRAISOAE HC-M D7-14 B 4 B
531,358,CHRAISOU AK-R D4-41 AB 1 A
532,359,CHRAISUAE NF-Q C5-1 2 B
533,360,CHRAISUAE UD-T D3-1 5 A
534,361,CHRAUFAO PZ-C B15-0 4 A
535,362,CHRAUFAO VJ-Y D1-0 A 3
536,363,CHREETAA PP-B B0 4 B
537,364,CHU THUA HS-J B36-0 C 1
538,365,CL PISMIS 17 7 B A
539,366,CL PISMIS 19 A 1
540,367,CL PISMIS 3 CD 1 A
541,367,CL PISMIS 3 CD 1 B
542,367,CL PISMIS 3 CD 2 A
543,367,CL PISMIS 3 CD 2 C
544,367,CL PISMIS 3 CD 2 D
545,367,CL PISMIS 3 CD 2 E
546,367,CL PISMIS 3 CD 5
547,368,CLOOKEOU AK-B B58-11 D 4
548,369,CLOOKEOU CH-B D14-147 2 B
549,369,CLOOKEOU CH-B D14-147 2 F A
550,370,CLOOKEOU NE-D B56-4 B 1 A
551,371,CLOOKEOU RF-D D13-84 2 A
552,372,CLOOKEOU UT-I C25-22 A 1 A
553,373,CLOOKEOU VL-B D14-114 2 A
554,374,CLOOKEOU VL-B D14-121 ABCD 1 A A
555,375,CLOOKOU TS-S D4-45 AB 1
556,375,CLOOKOU TS-S D4-45 AB 3
557,376,CLOOKU AL-G B56-16 3 A
558,376,CLOOKU AL-G B56-16 3 C
559,376,CLOOKU AL-G B56-16 3 D
560,376,CLOOKU AL-G B56-16 3 E
561,376,CLOOKU AL-G B56-16 4 A
562,376,CLOOKU AL-G B56-16 6 A A
563,376,CLOOKU AL-G B56-16 6 B A
564,377,CLOOKU BA-A G30 B 11 A
565,378,CLOOKU BC-O C9-252 B 1
566,378,CLOOKU BC-O C9-252 B 4 A
567,378,CLOOKU BC-O C9-252 B 4 B
568,378,CLOOKU BC-O C9-252 B 4 C
569,379,CLOOKU CL-A C3-1151 A 3 B
570,379,CLOOKU CL-A C3-1151 A 3 C
571,380,CLOOKU CL-A C3-80 1 A
572,380,CLOOKU CL-A C3-80 3 A
573,381,CLOOKU DI-V B22-105 1 A
574,381,CLOOKU DI-V B22-105 1 B
575,381,CLOOKU DI-V B22-105 1 C
576,381,CLOOKU DI-V B22-105 2 A
577,381,CLOOKU DI-V B22-105 2 B
578,381,CLOOKU DI-V B22-105 2 C
579,382,CLOOKU DX-I D10-255 2 B
580,383,CLOOKU EW-Y C3-197 2
581,383,CLOOKU EW-Y C3-197 5 G A
582,384,CLOOKU FH-S D5-2026 2
583,384,CLOOKU FH-S D5-2026 2 A
584,384,CLOOKU FH-S D5-2026 3
585,384,CLOOKU FH-S D5-2026 3 A
586,384,CLOOKU FH-S D5-2026 4
587,384,CLOOKU FH-S D5-2026 7 A
588,384,CLOOKU FH-S D5-2026 7 C
589,385,CLOOKU HJ-L B14-111 5 G A
590,386,CLOOKU ID-O B25-7 AB 1
591,387,CLOOKU IH-S D5-134 1 A
592,387,CLOOKU IH-S D5-134 3 A
593,387,CLOOKU IH-S D5-134 3 B
594,387,CLOOKU IH-S D5-134 4 A
595,387,CLOOKU IH-S D5-134 4 B
596,388,CLOOKU KF-Y C17-1298 4 A
597,388,CLOOKU KF-Y C17-1298 4 D
598,388,CLOOKU KF-Y C17-1298 4 E
599,389,CLOOKU KM-L D8-274 C 5 A
600,390,CLOOKU KO-P B39-117 2 A
601,390,CLOOKU KO-P B39-117 2 B
602,390,CLOOKU KO-P B39-117 2 C
603,390,CLOOKU KO-P B39-117 3 A
604,390,CLOOKU KO-P B39-117 3 B
605,390,CLOOKU KO-P B39-117 3 C
606,390,CLOOKU KO-P B39-117 3 G
607,390,CLOOKU KO-P B39-117 3 H
608,391,CLOOKU LN-X B7-124 1 A
609,391,CLOOKU LN-X B7-124 1 D A
610,392,CLOOKU MC-V E2-412 2
611,393,CLOOKU ME-G B44-98 3 B A
612,393,CLOOKU ME-G B44-98 3 D A
613,393,CLOOKU ME-G B44-98 4 B
614,393,CLOOKU ME-G B44-98 4 C
615,394,CLOOKU MM-C D43 3 A A
616,395,CLOOKU OY-V B8-125 3 A
617,396,CLOOKU RB-N C23-206 AB 2 A
618,396,CLOOKU RB-N C23-206 AB 3 A
619,396,CLOOKU RB-N C23-206 AB 3 B
620,396,CLOOKU RB-N C23-206 AB 3 C
621,396,CLOOKU RB-N C23-206 B 1
622,396,CLOOKU RB-N C23-206 B 4 A
623,397,CLOOKU RJ-T C6-562 2 A
624,397,CLOOKU RJ-T C6-562 4 B A
625,397,CLOOKU RJ-T C6-562 5 A
626,397,CLOOKU RJ-T C6-562 5 B
627,398,CLOOKU RM-M C23-223 A 1 A
628,399,CLOOKU SI-B E544 1
629,400,CLOOKU UK-S B10-67 2 A
630,400,CLOOKU UK-S B10-67 2 B
631,401,CLOOKU UP-J C24-226 2 B
632,401,CLOOKU UP-J C24-226 2 C
633,402,CLOOKU UZ-E D12-45 2
634,403,CLOOKU WU-V D3-754 3
635,404,CLOOKU WZ-M B12-26 1
636,405,CLOOKU XQ-Q B11-176 B 1
637,406,CLOOKU YC-V B22-53 B 2 A
638,407,CLOOKU YJ-Z E313 B 2
639,408,CLOOKU ZE-E B4-111 1 A A
640,409,CLOOKUIA AW-V B16-0 B 3 A
641,410,CLOOKUIA FX-S C17-0 6 A
642,411,CLOOKUIA IZ-L B35-0 2 A
643,412,CLOOKUIA LT-T C3-3 B 1
644,413,CLOOKUIA MI-K D8-2 E 2
645,413,CLOOKUIA MI-K D8-2 E 3
646,414,CLOOKUIA OI-K D8-8 1 C A
647,415,COALSACK DARK REGION YJ-A D57 5 A A
648,416,COALSACK SECTOR TO-R C4-9 A 1
649,416,COALSACK SECTOR TO-R C4-9 A 4
650,417,COELACHI 3 D
651,418,COJUIA WL-J D10-1 D 5
652,419,COL 132 SECTOR GH-V E2-13 7 E A
653,420,COL 132 SECTOR IN-S D4-64 5 A
654,421,COL 132 SECTOR LJ-O B36-3 B 2 A
655,422,COL 132 SECTOR NT-Q D5-51 3 D
656,423,COL 132 SECTOR UB-R C19-5 D 3
657,424,COL 132 SECTOR WD-N B9-1 A 1 A
658,425,COL 135 SECTOR BC-K B9-0 C 2 A
659,426,COL 135 SECTOR DL-N B7-0 1
660,427,COL 135 SECTOR FR-V C2-19 3
661,428,COL 135 SECTOR LC-V D2-62 1 C
662,429,COL 135 SECTOR RO-Q C5-5 C 4 A
663,430,COL 135 SECTOR RO-Q C5-7 E 1
664,431,COL 135 SECTOR TU-O C6-15 A 3
665,431,COL 135 SECTOR TU-O C6-15 D 1
666,432,COL 135 SECTOR TU-O C6-8 4
667,433,COL 135 SECTOR UU-O C6-2 A 1
668,434,COL 140 SECTOR IH-V D2-44 1 D A
669,435,COL 173 SECTOR AB-N D7-34 B 3
670,436,COL 173 SECTOR AI-H C11-22 B 1
671,437,COL 173 SECTOR AP-Q B21-2 A 8
672,437,COL 173 SECTOR AP-Q B21-2 B 4
673,438,COL 173 SECTOR AU-Y B30-2 B 4
674,439,COL 173 SECTOR AV-N B23-5 A 2
675,440,COL 173 SECTOR AY-F C12-0 A 1
676,441,COL 173 SECTOR BH-K B25-8 B 3
677,442,COL 173 SECTOR BH-L D8-72 B 5 A
678,443,COL 173 SECTOR BN-Y C15-3 A 3 A
679,444,COL 173 SECTOR BO-F C12-24 A 3
680,445,COL 173 SECTOR BV-M B24-10 B 1
681,445,COL 173 SECTOR BV-M B24-10 B 2
682,446,COL 173 SECTOR BV-M B24-7 A 3 A
683,447,COL 173 SECTOR BV-O D6-55 6 A
684,448,COL 173 SECTOR BX-I C10-7 B 2
685,448,COL 173 SECTOR BX-I C10-7 B 3
686,449,COL 173 SECTOR CC-K B25-8 A 5
687,450,COL 173 SECTOR CG-M B24-8 A 4
688,450,COL 173 SECTOR CG-M B24-8 A 5
689,451,COL 173 SECTOR CH-L D8-14 D 1
690,451,COL 173 SECTOR CH-L D8-14 D 3
691,452,COL 173 SECTOR CI-Y C15-1 B 6 A
692,453,COL 173 SECTOR DG-M B24-4 A 2
693,453,COL 173 SECTOR DG-M B24-4 B 1
694,453,COL 173 SECTOR DG-M B24-4 B 2
695,453,COL 173 SECTOR DG-M B24-4 B 3
696,453,COL 173 SECTOR DG-M B24-4 B 4
697,454,COL 173 SECTOR DG-M B24-5 A 2 A
698,454,COL 173 SECTOR DG-M B24-5 B 5
699,454,COL 173 SECTOR DG-M B24-5 B 6
700,455,COL 173 SECTOR DH-K B25-2 A 5
701,455,COL 173 SECTOR DH-K B25-2 A 7
702,456,COL 173 SECTOR DK-Y B30-2 A 2
703,456,COL 173 SECTOR DK-Y B30-2 A 3
704,457,COL 173 SECTOR DM-U D3-82 A 2 A
705,458,COL 173 SECTOR DO-F C12-4 A 1
706,459,COL 173 SECTOR DZ-D C13-2 12 A
707,460,COL 173 SECTOR EC-K B25-0 6
708,461,COL 173 SECTOR EC-L D8-54 1 C
709,462,COL 173 SECTOR EM-L D8-69 B 2 A
710,463,COL 173 SECTOR EZ-D C13-25 B 1
711,464,COL 173 SECTOR FC-L D8-28 14 C
712,465,COL 173 SECTOR FJ-E C13-6 2 B
713,466,COL 173 SECTOR FS-I C10-2 B 4
714,467,COL 173 SECTOR FZ-D C13-30 2
715,468,COL 173 SECTOR GA-O B23-1 B 1
716,469,COL 173 SECTOR GA-O B23-4 B 1
717,469,COL 173 SECTOR GA-O B23-4 B 2
718,470,COL 173 SECTOR GG-E B28-3 A 1 A
719,471,COL 173 SECTOR GS-J B25-4 D 2
720,472,COL 173 SECTOR HI-M A55-0 A 2
721,472,COL 173 SECTOR HI-M A55-0 A 3
722,473,COL 173 SECTOR HM-M B23-3 A 3 B
723,474,COL 173 SECTOR HM-Z B28-1 A 3
724,474,COL 173 SECTOR HM-Z B28-1 A 4
725,475,COL 173 SECTOR HN-I B26-5 A 1
726,476,COL 173 SECTOR HN-J D9-52 1 A
727,476,COL 173 SECTOR HN-J D9-52 1 C A
728,476,COL 173 SECTOR HN-J D9-52 2 A
729,476,COL 173 SECTOR HN-J D9-52 2 B
730,477,COL 173 SECTOR HP-D C13-11 B 1
731,478,COL 173 SECTOR HR-M B23-3 B 7
732,478,COL 173 SECTOR HR-M B23-3 C 1
733,478,COL 173 SECTOR HR-M B23-3 C 2
734,478,COL 173 SECTOR HR-M B23-3 C 5
735,479,COL 173 SECTOR HS-S D4-77 BC 4 A
736,480,COL 173 SECTOR HU-D C13-2 A 1
737,481,COL 173 SECTOR IJ-G B27-1 A 1
738,482,COL 173 SECTOR IL-M C8-5 4 A
739,483,COL 173 SECTOR IU-C C14-24 D 4 A
740,484,COL 173 SECTOR IV-F B27-1 A 1 A
741,485,COL 173 SECTOR JB-F B27-1 A 4
742,485,COL 173 SECTOR JB-F B27-1 BC 3
743,486,COL 173 SECTOR JI-J B25-0 AB 2
744,487,COL 173 SECTOR JP-C C14-13 2
745,487,COL 173 SECTOR JP-C C14-13 3
746,488,COL 173 SECTOR JP-D C13-14 A 4
747,489,COL 173 SECTOR JX-K B24-0 B 2
748,489,COL 173 SECTOR JX-K B24-0 B 4
749,489,COL 173 SECTOR JX-K B24-0 B 4 A
750,490,COL 173 SECTOR KN-J B25-5 C 3
751,491,COL 173 SECTOR KP-T B34-8 B 2
752,492,COL 173 SECTOR KS-J D9-37 A 5 A
753,492,COL 173 SECTOR KS-J D9-37 A 5 B
754,493,COL 173 SECTOR KT-G B40-2 A 3
