id,grCodexCategory,grPrimaryArtifact,grSecondaryArtifact,codexNumber,text
92,5,2,4,11,"Once area I was unsure about until now was whether the Guardians used their abilities in genetic and biological manipulation to advance their technology and weapons. While some might argue that our technology is equal to the Guardians', I would counter that their integration of such technology at a societal level gave them a greater knowledge of its application. As well as biological warfare agents, they also created creatures expressly for use in battle, and these remained effective even into the modern era."
93,5,2,3,12,"This data you have collected contains details of weaponry the Guardians developed. The guardians' projectile weapons utilised electro-magnetic propulsion, much like their space technology. Such weapons were manufactured in a range of scaled, from personal weapons to capital-ship class. Generally the Guardians used kinetic energy in combat, and explosives were rarely deployed. Nuclear fission and fusion were developed during the Guardians' astro-expansion period, but when it came to large-scale destructive weaponry they relied on bespoke biological weapons. Predictably, these were of little use against the AIs."
94,5,2,3,13,"This data contains details of shield technology. The Guardians developed powerful shields that were far in advance of our own. Whole cities were protected by huge shields able to resist even bombardment from space, at least for a time, although these defences were ultimately overwhelmed during the second civil war"
95,5,2,NULL,14,"This data makes up a group of entries regarding the Guardians military. For most of their history the Guardians made use of small forces that combined the roles of military and police. These forces were comprised of volunteers, whose conscription was part of a tacit social contract. In times of war these forces could be expanded rapidly, as most of the adult population had already received basic training."
96,5,2,2,15,"This data makes up a group of entries regarding the Guardians military. From a military perspective the Guardians had an obvious weakness. Most of their history was peaceful, meaning there was no institutional knowledge or experience of combat. Consequently, tactics and strategy were for the most part theoretical. This, combined with various other factors, resulted in a devastating number of casualties during the second civil war."
97,5,2,1,16,"This data contains some details regarding AI in the Guardians society. The rise of the artificial intelligence almost elevated the Guardians' society to a whole new level. There are parallels between the Guardians' experience of machine sentience and our own, but as with other aspects of their society, the key difference was the way AIs were socially integrated in to the Guardians' lives. If this process had not been hindered by the rise of the religious abolitionist movement, I believe a technological symbiosis and utopia could have been achieved, but alas id was not to be."
98,5,2,6,17,"This data gives details of the Guardians research into computer techonolgies. The Guardians' computer hardware operated on the same principles as our own. Their engineering was more sophisticated, but even to a layperson such as myself if it comprehensible. They experimented with organic computers, but ultimately these failed to meet expectations, except in a few areas such as bio-monitoring. Even then, genetically modified organisms usually performed better."
99,5,2,4,18,"This data contains some details regarding AI in the Guardians society. What really sets the Guardians apart from humanity, technologically, was the way they embraced neutral implantation and artificial intelligence. Not only did the implants enhance one's mental capacity, they also provided one with a direct connection to the monolith network and the fledgling AIs. It was this symbiosis that fuelled the rapid advancement of technology during this era, but unfortunately this same advancement also resulted in the ultimate destruction of their species."
100,5,2,5,19,"This data contains some details regarding AI in the Guardians' society. The early AIs were designed with two goals in mind. The first was to augment the abilities of the Guardian operators who were responsible for managing the monolith network and interaction with the AIs - a goal they achieved. The development of shared thought-space technology and neural networking gave their civilisation an unprecedented intellectual boost. The second was for the AIs to actually drive their own development, which they also achieved. The first few generations of AI relied heavily on the monolith network, but they soon evolved into a more distributed model by storing their consciousness within the implants."
101,5,2,3,20,"This data contains some details regarding AI in the Guardians society. At this stage, social engineering was being used to ensure the AIs adhered to the same user model as their progenitors. But during the first civil war, most implanted Guardians were exiled, and the AIs recognised their vulnerability. They responded by developing their own operational hardware, independent of implanted Guardian users. Frustratingly, the details of these mechanisms have been purged from the record, possibly by the religious extremists who formed the last of the Guardians' species."