id,grCodexCategory,grPrimaryArtifact,grSecondaryArtifact,codexNumber,text
1,1,6,3,1,"Thank you commander, this data has proven vital to my ongoing research. While it seemed logical that the alpha-pattern data corresponded with the core information on the Guardians' biology and ecology, I couldn't be certain until I received the data from your scan. I'm pleased my hypothesis has proved correct, and I've started to unlock some fascinating details about the Guardians. The extracted data relates to individuals rather than their species as a whole, but thanks to the information you have transmitted, I believe I will be able to merge the data to create a general picture."
2,1,6,6,2,"The information you've uncovered is very interesting and regards the Guardians' anatomy and physiology, you might be surprised to learn they weren't that different to us. Their morphology was bipedal, although they were generally taller and more slender than the average human. Their skin tone was red, encompassing the whole spectrum of red hues. There were various reasons for these changes in pigmentation, including genetic disposition and the fact that they darkened as they aged"
3,1,6,1,3,"Details on the facial structure of the Guardians. Their faces were proportionally smaller than ours and they had round eyes, darkened from their evolution under a very strong sunlight. The colouration and structure of the eye indicates that not only they have keener vision than us, but they could also see a wider spectrum."
4,1,6,4,4,"This data details the facial structure of the Guardians. The nose appears to have been vestigial - I believe it was once more pronounced, but that some environmental change made it less useful - so their sense of smell would have been less developed than the human average. Their ears were very tightly formed against the skull, and the interesting array of internal acoustic chambers suggest they perceived sounds differently to us"
5,1,6,2,5,"This data offers more details about the physical appearance of the Guardians. Most remarkable are their limbs. Their forelimbs had a serrated edge and were no doubt used as killing implements during the pack-hunting period. They had two more more joints in their arms than we do, facilitating complex articulation and the use of sophisticated sign language. The skeleton was flexible yet resilient and their muscles were long, thin and ropey. They had two hands, each with four digits."
6,1,6,5,6,"We've barely scratched the surface with the Guardians. There is so much yet to discover. But this new data contains one tantalising detail that stands out: their biochemistry was very similar to our own. They had blood in the same fashion as us, and it fulfilled exactly the same role as it does for us. Beyond this, they share a similar genetic structure, with DNA and RNA their core building blocks. Although a full analysis has not yet been conducted, this might be evidence of a common ancestor, but also of a branching in their genetic history. This is an astounding discovery!"
7,1,6,3,7,"This data offers more details about the physical appearance of the Guardians, specifically regarding genders. The similarities between humans and the Guardians continue to delight me. They had two distinct genders and reproduced sexually. There don't appear to have been any taboos surrounding sexual activity, as the data contains a large quantity of graphic images and recordings – not unlike some of our data nets!"
8,1,6,6,8,"This data contains more details about the Guardians' sexual behaviour and reproduction. Their body form encouraged sex while standing, but although this was the most comfortable pose, they entertained a variety of positions. I've concluded that sex was a recreational behaviour and not only for procreation. They didn't use birth control as they could manipulate their bodies to become temporarily sterile at will, although I've not yet identified the precise mechanism for this. It's clear their biological-manipulation technology was quite sophisticated. This data has huge applications for Medical treatments if we can unlock the secret."
9,1,6,1,9,"This data contains more details about the Guardians' procreation and reproduction. Procreation was a matter of personal choice, although they were required to be a parent at least once during their lives to ensure the continuation of their genetic line. I've not yet established their metric for measuring time, but it's clear that the period of gestation was quite long, to allow substantial development of the young prior to birth. The infants were effectively helpless for a period after delivery."
10,1,6,4,10,"This data contains more details about the Guardians' approach to raising their young. Care of the young was the duty of the wider community. Infants were raised in communal crèches rather than by their parents, the cultural significance of which I'm eager to unravel. I have established that prenatal care of the young involved genetic manipulation to remove hereditary diseases and other complications."
11,1,6,2,11,"Although the alpha-pattern data encapsulates biological information, it also contains a treasure trove of cultural data. This is particularly true of the data you uncovered here. The data package appears to contain records pertaining to their food. I already knew that as pack hunters they were carnivores. I subsequently discovered that not only were their arm ridges excellent for killing prey, they also used for cutting meat into little pieces to fit in their small mouths."
12,1,6,5,12,"This data contains details about etiquette and hunting. The imperative of the kill was retained even as their society advanced. Food killed in the hunt was a delicacy. For guests, it was an honour to provide their host with something that had been hunted, but the host was expected to provide the same. Meat that had been hunted by a lone individual was given even greater accord. For a kill to be valid, it had to be achieved without weapons. Weaponry was only for civil defence or law enforcement."
13,1,6,NULL,13,"This data contains details about etiquette feeding habits and hunting. Non-indigenous animals were considered a particular delicacy. The Guardians' expansion into space introduced them to new ecologies and, consequently, to new food. So far I've had little success in determining the details of these alien creatures or where they were obtained, but it was certainly a valuable trade for the Guardians. Huge parks and reserves were constructed on their worlds where they could hunt both local and imported animals."
14,1,6,6,14,"This data is particularly interesting. It appears that another indication of their prowess in biological manipulation was the creation of unique creatures for consumption. This was done to ensure adequate supplies for the general population, although there was also a specialist trade. Having an animal created for a specific celebration demonstrated the owner's status and wealth, but being the creator of such a delicacy meant even greater honour. This part of the research could aid us in food production and make famine a thing of the past."
15,1,6,1,15,"It seems that most of this data package has become corrupted, however I have been able to decipher one section. It seems that the Guardians retained the ability to digest raw meat, and most meals were served uncooked, although they did appreciate cooked meat. This became an almost ceremonial aspect of their eating, and was often incorporated into formal meals."
16,1,6,4,16,"This data is fascinating commander. I now have a better understanding of the types of environment and how that relates to the Guardians' development. The alpha-pattern data has yielded a wealth of information on the Guardians, but throughout my research I've also been looking for information on their homeworld...and now I think I've found what we need! The location of their homeworld still eludes me, but this new data may give enough for us to narrow the search criteria."
17,1,6,2,17,"This data contains more details about the Guardians' physiology regarding their environment. Looking through previous data collected by pilots like yourself, It came as no surprise to learn that their environmental requirements were very similar to our own. Barring any local biological threats, we could easily live on their worlds - they wouldn't even need terraforming. In fact, we would find their worlds more comfortable than the Guardians would ours."
18,1,6,5,18,"This data contains more details about the Guardians' physiology regarding their environment. I can see from this data that humanity would indeed be able to cope if not thrive on the same worlds as the Guardians and vice versa. The first key difference is gravity. Most of their worlds have a lower gravity rating than we would consider normal, which no doubt explains their taller, more slender frame. Their flexible bone structure would adapt to high gravity with little discomfort or loss in physical strength."
19,1,6,3,19,"This data contains more details about the Guardians' physiology regarding their environment. This data shows that they preferred warmer worlds than we do, and don't appear to have been well suited to colder climates. Fragments of their history reveal that they experienced changes in climate in their early history, and it was that - rather than conflict - that prompted their technological development. They had thick skins but lacked a fatty layer, which I think reduced their ability to function in cold temperatures. More and more, the alpha-pattern data extends to include aspects of their culture. It's fascinating subject matter, but I still need more data."
20,2,5,3,1,"This is very interesting commander. This is a new data pattern. I have given it the designation beta-pattern data. I can already report that it contains some fascinating insights into the Guardians culture. The first is that religion formed a large part of their lives. Strangely this seems to have occurred late in their development, after various technological revolutions. The details are a bit vague in this data package. There must be others that hold more cultural details. Please continue the search."
21,2,5,5,2,"Your hard work is paying off commander. This data holds more details about the Guardians' culture, specifically spiritual matters. Almost from the dawn of their civilisation they possessed a strong spiritual sense - one that reflected their close connection to the natural world. Even when they'd developed industrial-scale machinery, they maintained a balance with the world around them. Their ongoing love of hunting presumably played a significant part in this"
22,2,5,1,3,"This data holds more details about the Guardians' culture, specifically spiritual matters. This spiritual awareness sustained them through most of their history, but did not evolve into a formal religion. It was not until the development of machine intelligence, during the most rapid era of their development, that any sort of organised religion emerged. I speculate that this technological singularity alienated much of the population, who responded by rejecting this technology."
23,2,5,6,4,"This data holds more details about the Guardians' culture. The tipping point that gave rise to organised religion amongst the Guardians doesn't appear to have been the creation of thinking machines, but other technological developments - in particular a kind of implant that interfaced with the brain. Up to this point, biological enhancement and repair had utilised only organic-based systems, so this sudden change frightened many."
24,2,5,4,5,"This is very interesting, very interesting indeed. This data holds more details about the Guardians' culture. There was an anti-technology movement that rejected not only specific developments, but also inventions such as virtual reality. The loose customs associated with their affinity for nature formed the basis for a new belief system. It evolved rapidly - almost as quickly as the technological advancements produced by the scientists and machine intelligences. It's interesting to note the parallels with human-made sentient technology, and how its development threatened humanity during the golden age of technological advancement. The growth of this new religion divided the population, and conflict soon erupted"
25,2,5,2,6,"This data holds some shocking revelations. it talks about the religion that emerged towards the end of the guardians civilisation and I wont lie it has shocked me. while religion remains a feature of human society, unless you live in one of the more extreme theocracies, its generally a matter of personal faith rather than a generally accepted consequence of the human condition. I know some of my fellow researchers would disagree with me. but it is generally assumed that religious beliefs tends to reduce their potency as scientific understanding grows in the case of the guardians, the opposite holds true, it truly divided them."
26,2,5,2,7,"This data does not paint a bright picture of the Guardians culture at the point it was recorded. As I examined the data in this beta pattern and crossed references from other data I have received, I have learned that the truth wasn't quite so clear cut. The information I've extracted regarding their legal system indicates a stable and mature society. Given the physical similarities between us and them, I'm amazed at the cultural and societal differences and the speed at which they rose to become part of their lives."
27,2,5,5,8,"This data contains cultural data, specifically regarding the legal system of the Guardians. In contrast to many of our legal systems, the fundamental laws do not concern individual right, but instead focus on defining the individual's responsibilities to society. I'm sure this is another reflection of their pack mentality, where the requirements of the group supersede those of a single person. Naturally it isn't as simple as that in practice – for example, individuals were expected to come to another's aid if necessary."
28,2,5,1,9,"This data contains cultural data, specifically regarding the legal system of the Guardians. An individuals responsibility extended, past simply obeying the law to include elements of law enforcement. Society was self regulated, with everyone required to ensure laws were obeyed. These values were instilled in the young as part of their education in the communal crèches."
29,2,5,6,10,"This data contains cultural data, specifically further details regarding social responsibility. As well as being regulated, there was still hierarchical form of administration within the legal system. These were defined by areas of responsibility, but as with all the Guardians’ social structures, everyone was expected to participate, meaning that individuals were required to fill certain legislative roles as part of their everyday life. Some of the concepts aren’t completely clear, but I believe individuals were nominated and couldn’t hold office for more than a single term."
30,2,5,4,11,"An excellent discovery commander. I was wondering when we would find this type of cultural data. I had begun to fear it might not exist. You can tell a lot about a people from their art. Humanity has demonstrated great creativity in artistic expression throughout history, and I'm keen to compare our art with the Guardians'. Fortunately I've been able to tease some details from the beta-pattern data abstracts in this data package. We already knew they were capable of fabulous architecture, but these records show that buildings, statues, monoliths and even city layouts were a common outlet for aesthetic expression."
31,2,5,2,12,"This is truly fascinating data commander, as an engineer myself I have to admit I’m highly curious about the Guardians technology. It seems that the Guardians had a particular fascination with geometric shapes, which they used to illustrate connections between themselves and the world around them. This predilection manifested itself in their technology as well - specifically their monolith network. With this data and the help of the galactic community we’ve partially mapped the monolith network, which formed the backbone of their communications technology, and discovered that they too are arranged in geometric patterns. Whilst this does not give us full access to the network, I believe it is the first step to unlocking the entire system and maybe more."
32,2,5,3,13,"This data contains more details on the Guardians' culture, specifically art. Many of the records I've now extracted include the data you've just sent through, show that most of the Guardians' art had a religious basis. It seems that their shift to a religious society affected all aspects of their lives. I have found older records that indicate other art forms did exist, with realistic and abstract techniques evident. I hoping that some of the data we've yet to decode will contain images of these art works."
33,2,5,NULL,14,"This data contains more details on the Guardians' culture, specifically art and how it fitted into social responsibility. It appears each individual Guardian had a cultural commitment to create and share works of art. While it's clear that the quality varied between individuals, all works were considered worthy by virtue of their efforts alone. This package does in fact contain many images of their works. It is truly interesting, such a pity we might never know the meaning behind many of these pieces."
34,2,5,5,15,"A human observer might find the Guardians' visual art severe and lacking in emotion, but the same could not be said of their music. They didn't use musical instruments, so strictly speaking it's singing, although I think they might have used their bodies for rhythm and percussion. I've extracted audio from the data you have collected and have listened to, for want of a better term, their “songs”. The range of their voices is something to be admired. And it's so rich with emotion – many pieces are so haunting, it breaks the heart to listen them."
35,2,5,1,16,"This is very interesting data commander. The data describes what must have been a kind of counter culture. Dancing was considered taboo, especially when combined with language gestures, but there is evidence that gesture dances were popular with adolescents, possibly as a form of rebellion. I'm not sure why such activity was prohibited, but it might have something to do with potentially conflicting information - something they took great pains to avoid."
36,2,5,6,17,"This data contains details of other past times and cultural events. As a consequence of their extensive industrial automation, the Guardians had a lot more time for social pursuits than we do. It's another interesting contrast - we have a similar capability, but our fear of surrendering control to machine intelligence means we remain wedded to idiosyncratic working practices. We could learn so much from this species - I only hope that in some small measure my research guides us toward such enlightenment."
37,2,5,4,18,"This data contains details of other past times and cultural events. The Guardians didn't waste the freedom their technological advancements offered: leisure activities were encouraged, even expected, as part of normal social intercourse. Time was devoted to social responsibilities and furthering personal abilities. Scientific research is a good example of this. Although they stagnated in their later period, throughout their early history the Guardians had a societal obligation to seek out and share knowledge. Research was often conducted in vast collaborative programmes, which were also seen as vital learning experiences."
38,2,5,2,19,"This data contains more cultural information. Their attitude towards their varied endeavours sets them apart from humans. Their social obligations were not seen as chores - in fact they enjoyed participating in these roles. Because all were obligated to take part, it meant social responsibilities were often a short-term diversion, as well as allowing individuals to accrue a variety of experience. I also think there was a biochemical component that enhanced their enjoyment of such tasks, but I haven't been able to prove that supposition yet."
39,2,5,3,20,"This data contains more details about entertainment as a cultural activity. I believe this data show that the Guardians enjoyed what we would consider traditional entertainment. The performance of classical stories and historical epics seem to have been very popular. Their equivalent to theatre was more participatory than ours, with less of a distinction between audience and performer - so much so that the term 'enactment' might be more accurate than 'theatre'. It's just another example of this species' incredible social dynamics."
40,3,1,NULL,1,"While I haven’t been able to establish a granular time frame for the Guardians, This data you have uncovered has allowed me to identify general eras. Once again I am indebted to you for gathering valuable research data - particularly the gamma-pattern data packages that have helped me unlock this information. The new data illustrates the Guardians’ impressive development. Details of the Guardians’ very early history are sketchy at best, but there’s enough detail for me to reach a few conclusions. We know they evolved as pack hunters with tribal groups of 20 to 30 individuals. They lived in jungle regions similar to those found on Earth, and preferred very hot and humid climates."
41,3,1,1,2,"This data is remarkable and covers the early history of the Guardians. They were highly intelligent, and developed sophisticated and effective hunting strategies that quickly saw them become the apex predator in their biomes. Their agility allowed them to take advantage of varied terrain and so avoid predation themselves. I was surprised to learn they were nomadic rather than territorial, but this appears to have been motivated by a desire to mix with other groups and increase genetic diversity rather than a lack of prey. The Guardians developed their core vocal and gestural methods of communication quite early, although it wasn't until they developed tools that they were able to record suck communication."
42,3,1,6,3,"This data is very interesting and covers the early history of the Guardians. The Guardians' recorded history begins much earlier than it does in human history. Their early art appears to be concerned more with recording practical activity than with personal expression, so maybe this practicality was a factor. Their earliest records tell of a great upheaval caused by climate change, and although the exact cause isn't recorded, there are references to a dimming of the sun. Whatever the cause, the effect was a drop in global temperature. Having evolved to operate in a tropical environment, the Guardians were unsuited to the suddenly colder climate. But their intelligence allowed the to adapt better than other creatures in their ecology by building primitive shelters from plants"
43,3,1,4,4,"The data provides more details regarding the development of the Guardians in their early history. The worsening weather after what I understand as global climate change or possibly a cosmic event, precipitated the development of tools, which allowed the Guardians to build more durable structures. They soon learned to use stone in their buildings, and with this greater permanence they developed a deeper appreciation for the visual arts, using them to decorate the inside of their homes. Even at this early stage they were conscious of the need for urban planning, and one can clearly see a relationship between the layout of these early villages and the form of their later cities."
44,3,1,2,5,"This data holds details of the Guardians continue development. It appears that their early nomadic existence came to an end in the same period as the development of more permanent buildings - although the young were still encouraged to journey to other camps - and this switch to a more settled existence brought with it various social changes. For example, the Guardians began to use statues to mark out the regions occupied by a specific clan. It's interesting to note, however, that I have found little evidence of conflict between neighbouring clans. Evidently, the careful management of their populations resulted in cooperative strategies rather than competitive ones."
45,3,1,5,6,"This data contains evidence of increased animal husbandry within the first early settlements, no doubt to ensure adequate food supplies. More startling is the fact that they also practised selective breeding. They possessed a reasonable understanding of inherited traits, which is remarkable given their level of technological development"
46,3,1,3,7,"This data contains evidence that in their late history the Guardians entered an era of great technological development, although this process also precipitated a period of conflict. Their most notable advances were in the field of genetic manipulation. Early experiments involved captive animals before moving on to micro-organisms, the latter triggering advances in medical sciences and engineering. One example is the development of virus-like organisms used to combat specific diseases and supplement the Guardians’ immune systems. This data will be priceless to medical teams throughout the galaxy. More and more I feel we need to publish our results to all. I think that would have been in keeping with the social responsibility shown by the Guardians."
