id,grCodexCategory,grPrimaryArtifact,grSecondaryArtifact,codexNumber,text
47,3,1,NULL,8,"This data contains details regarding the rise of new technologies. It appears that the development of these technologies varied between clans, creating inequality and, ultimately, conflict. Initially, that conflict was resolved through personal combat between individual champions, but as clans started using numbers to overwhelm their opponents, the practice of warfare began to spread. This led to a surge in weapons development, with biological warfare quickly established as the weapon of choice. An arms race began, focused on the development of biological agents and various counter measures. It saddens me to discover this as I had hoped the Guardians would prove to be more advanced. A little naive I know as conflict is a common element of many species throughout the galaxy. Whether for resources, land or power over others. We all seem too share this shame."
48,3,1,1,9,"This data contains the details of the weaponry the Guardians developed during the various conflicts that swept over their civilization. As well as biological weapons, the first flight systems (in the form of airships) and computers were developed around this period. These early computers were used to model the effects of large-scale biological attacks. The spread of war had a devastating impact on the Guardians' social systems. Population control vanished as the clans realised they needed to be able to absorb large numbers of casualties. The cooperative social Paradigm collapsed and schisms of appeared between populations. I haven't determined exact dates yet, but I'm confident this era of conflict lasted for several centuries."
49,3,1,6,10,"This data tells of the end of a major conflict in the Guardians history and he rise of their modern society. It took the leadership of a few clans, from the north of the main continent, to restore peace. These clans had endured considerable hardship during their early development, perhaps resulting in a stronger breed. Banding together, they fought a swift war of conquest and brought the entire race under their leadership. It was from this that the Guardians' modern society, with its rules and balance, developed. Interestingly I've noticed evidence of a genetic break along the north-south divide and of redder skins among the northern clans, suggesting a racial element to the division."
50,3,1,4,11,"This data speaks about Guardians history and the development of their modern society and the first interest in off world exploration. The Guardian city-states continued to operate for over a thousand years, and the ancient forms of cooperative advancement resulted not only in a large population but also a peaceful and generally happy one. But with a finite amount of land available this population growth couldn't continue forever, and as the Guardians neared the limits a conference was organised. Astronomical research had become vogue in the previous decades, and the Guardians had identified a number of accessible planets capable of supporting life. Many individuals aspired to travel among the stars and colonise other planets. At first, such ambitions did not receive much support, but after options such as stricter population control were deemed undesirable, off-world colonisation became the most popular option"
51,3,1,2,12,"This data is incredible. The information regarding the Guardians first attempts at space travel are particularly interesting. Although the Guardians clearly had the capacity for sophisticated flight technology, they had not built anything more advanced than dirigibles, no doubt because airships were more in keeping with their ecologically conscientious philosophy. With rocket technology deemed environmentally unfriendly, they developed vast launchers that used electro-magnetic propulsion to catapult ships into space. Breathable gel cocoons helped pilots and passengers withstand the huge G-forces experienced on launch, and served as hibernation pods during long journeys. Having not yet developed faster-than-light technology, the Guardians constructed three large arks for their first interstellar colonies. Much like the Generation ships in our own history."
52,3,1,5,13,"This data is extremely exciting commander. Contained in this package is information regarding the Guardians use of faster than light communication. Almost the entirety of the Guardians' society was devoted to researching interstellar travel and communication. A breakthrough in faster-than-light communication was made before the arks reached their destinations, but the information was transmitted to the arks while they were still in transit, allowing the colonists to establish faster-than-light communications when they landed. Consequently, the interstellar network was developed extremely quickly. The arks kept the population at a manageable level long enough for the Guardians to develop hyperspace technology, which fuelled their expansion into the galaxy. The project also cemented the cooperative city-state model, which would serve the Guardians until their ultimate demise."
53,3,1,3,14,"This data describes what the guardians referred to as an age of information. Although the Guardians had used computers for generations, it wasn't until the development of artificial intelligence that they truly entered an information age. This saw the construction of what ultimately became the monolith network – an interstellar communication and computing system. The network existed before the development of AI, but it was the creation of machine intelligence, along with the development of neural implants, that brought this network into the heart of the Guardians' society."
54,3,1,5,15,"Commander this data has proven vital in our attempt to understand the Guardians Technology. It appear the the development of AI increased their technology very quickly. This sudden increase in computational ability – a result of the new implants, allowed the AIs to adapt and eventually evolve true sentience. This sparked a technological singularity – a rapid advancement across the whole landscape of science and technology. As the AIs developed further, this effect snowballed. In conjunction, many Guardians received implants so they could keep up with the extraordinary pace."
55,3,1,3,16,"This data contains evidence that not all individuals adopted the new technologies and received implants, and the rapid pace of the technological revolution resulted in new forms of inequality and threatened the very fabric of society. Unfortunately, they were unable to muster a unified response to these changes, which widened the gap between those who accepted the changed and those who resisted them. The politicians were the first to react to the changing social landscape, but soon the resistance to the technological revolution took on a religious overtone."
56,3,1,5,17,"According to this data, the Guardians' homeworld served as a powerbase for this new religious order, which eventually succeeded in ostracising or exiling all of its opponents. I can find no other reference to these exiles in the historical record. This development should have resulted in peace, but a further division arose over the fate of the AIs. At that time, the AIs were virtual entities, and so were reliant on the monolith network to exist. Because this made them vulnerable, they searched for a way to achieve independence from the network. Their research aroused the fear of the abolitionists, who used violent methods to prevent the AIs from achieving independence, and even to combat those Guardians who accepted the AIs."
57,3,1,1,18,"This data describes details about the Guardians second civil war. The war was ostensibly fought between the people of the homeworld and the colonies, but in truth there were divisions even among individual city-states. The scale of the conflict far exceeded that of the first civil war. In human terms, the first Guardian civil war was little more than a political clash, albeit with some violent conflict, but the second was an all-out war between the abolitionists and the rest of society. The war eventually destroyed the Guardians' habitats, forcing them to retreat into 'sacred' domes protected by powerful shields"
58,3,1,6,19,"This data describes details about the Guardians second civil war. The war raged for many years and eventually destroyed the Guardians' habitats, forcing them to retreat into 'sacred' domes protected by powerful shields. Eventually even the domes were destroyed, or their shields failed, and ultimately the population died out. Their predilection for expending resources on honouring the dead - a key tenet of their religion - only served to accelerate their extinction. Records indicate some variation in the nature of this devastation, most obviously at sites consisting of multiple domes. In these locations it appears the inner domes were destroyed later than the outer ones, as indicated by the slightly lower radiation signatures in the inner areas. I can only surmise that the attackers returned, after an initial assault, to finish the job."
59,3,1,4,20,"This data describes details about the Guardians second civil war. It appears that the Guardians approach to warfare vastly changed as the war continued. Warfare was conducted using automated battle fleets. At first these were controlled by the Guardians via brain implants, but later they became entirely autonomous. In the early stages of the war the Guardians fought each other directly, but within a decade - and after much loss of life - most of the fighting was conducted remotely. Soldiers were deployed only to occupy areas that had been captured by autonomous or remote vehicles, and eventually were not used at all."
60,3,1,2,21,"This data describes details about the Guardians second civil war. The war raged for over a hundred years, and Guardian populations fell dramatically during this time. Fertility rates dropped due to increased radiation levels and because the Guardians considered it blasphemous to use technology to address a biological issue. Eventually, one of the competing forces triumphed, but by that point, all the Guardians other than those who had been exiled a century earlier were dying."
61,4,4,NULL,1,"This is fascinating! The obelisks are clearly some form of data storage, but so far I haven't been able to determine what other purposes they might have had. I am very much indebted to the you commander for searching for the information I need, although I wish I could see the obelisks for myself. Perhaps closer proximity would inspire greater understanding! Unfortunately my responsibilities here preclude me from such adventure. I believe these are the first clues to understanding the alien language."
62,4,4,4,2,"I'm not disheartened, our early interactions have provided the basis for my research. The illuminated patterns are of obvious importance, and I believe represent a form of writing. Their illumination and movement suggest some additional meaning - so much so that I can't accept that they're merely signs or labels. There is a definite structure here, one that I intend to decipher. The more data you can collect the more I can correlate in the hope of assembling a kind of Rosetta Stone for their language."
63,4,4,1,3,"It appears I was correct in my theory that the delta-pattern data was the key to unlocking the language of this dead race. Sometimes you have to operate on intuition, but this data you've uncovered makes a connection between some of the glyphs on the obelisks and the forms in the data you have provided. I believe the delta patterns could be the building blocks of a lexicon."
64,4,4,6,4,"From the data packet you've discovered here I've gained a sense of a very cooperative society - one in which all elements worked in unison towards a common purpose. I also believe they shared an expectation of mutual protection. I'm still delving into these mysteries, but I believe 'Guardians' would be a good name for this species."
65,4,4,2,5,"It's dawned on me that the task ahead of us is colossal, and one I eagerly throw myself into. With the help of brave pilots like you, my analysis has revealed there is variation in the data blocks which you are discovering, which I think represents their equivalent of words. This indicates that their language was almost a universal one, which will make my efforts to understand it easier."
66,4,4,4,6,"This data packet indicates that the guardians used two different forms of communication with the same - or at the very least similar - language constructs, its slow but fascinating work, using this data I believe I can establish a rudimentary understanding of the oldest two forms - verbal communication. like us they had a vocal language, and the range of sounds appears to be similar to that used in human vocalisation."
67,4,4,3,7,"This is a great find commander. According to this data I've been able to deduce that verbal communication emerged early in their history. The scale of the archaeological sites suggests a social society with large populations. There is some supposition on my part, but the data you just found seems to support this contention"
68,4,4,NULL,8,"Excitingly, this group of delta-pattern recordings contain audio data. Not only will this help me establish the range of sounds they could make, it has should also allow me to confirm that they spoke with accents, as there are regional variations in the sound of their words."
69,4,4,4,9,"The decoder is having a problem deciphering this data packet and is running slower than I'd hoped. The data is formulated in such a way that individual constructs are easily extracted, but there seems to be stopping the decoder putting it all back together. I had assumed it would be simpler to establish a list of words even if I didn't know the meanings. The relationship between the audio data and the constructs, which I believe to represent their written form, Has revealed to be more complicated than I originally thought. Here is comes. This data seems to suggest that their spoken language was of a tonal form, similar to some human languages, meaning that the exact meaning of a word was determined by how it was said."
70,4,4,1,10,"With this data we've made a significant advancement. I believe we have identified what might be full sentences for the first time. Words are only fragments of a language – sentences illustrate the rules of it. It's only natural that an alien language would be structurally different to human ones. I'm realising that what I'd deciphered from the previous data packets were simply nouns. So I decided they must be lists, and looked for other more varied forms. Unfortunately I met with no success, until now."
71,4,4,6,11,"This Data is just what I’ve been looking for. I had been in a deadlock until the pattern-recognition software highlighted some repeating motifs in this data package. Delving deeper, I think I can establish that not only did variance in sound produce different meanings, but that the placement in relation to other words also altered the meaning. This is a real breakthrough!"
72,4,4,2,12,"This data package is huge. I could all too easily be distracted by the wealth of audio data in these delta patterns. To actually hear the Guardians' language as it would have been spoken proving too great a temptation. But this data reveals that the formal basis of their communication was visual rather than verbal. This seems logical, as the written word has more portability ad permanence than speech. I plan to dig deeper into the information collected by you and other explorers to learn the visual form, which I believe originated much earlier in the Guardians' development than I originally thought"
73,4,4,5,13,"This data proves a theory I had that the written form of the Guardians’ language is based around glyphs, with each glyph representing a single word. Once I’ve fully identified these, the process of separating tonal meanings should become much easier. The glyphs seem to be able to be combined to describe complex concepts, but could also communicate additional layers of meaning through the inclusion of movement. Each glyph is a symbol. They are more abstract than pictorial hieroglyphics, but its possible to identify a simplistic reference to the shape of the thing being described - for example, the glyph for ‘moon’ incorporates the waxing and waning as it would have appeared from the Guardians’ homeworld"
74,4,4,3,14,"This data contains the most amazing revelation. It appears to be the key to tracing the origins of the language embedded in the glyph formats. It's almost as if their glyphs contained a form of version control that represented the glyphs' evolution, and this ha given me a glimpse into their history. These glyphs actually evolved from a form of sign language that the guardians developed when hunting. The Guardians were originally pack hunters, and this sign language functioned as a stealthy means of communication"
75,4,4,NULL,15,"Judging from the shape and movement of these primitive glyphs, I have surmised the Guardians had tremendous dexterity and freedom of movement in their forelimbs and hands, and this has provided the first real glimpse of their physiology."
76,4,4,4,16,"The data here contains details of how the glyphs evolved into a formal form of communication, but there appears to be a conceptual gaps between speech and the glyphs. From the results of your scan, I can see that while all glyphs have a matching vocalisation, not all vocalisations have a matching glyph. Although the dictionary is still quite sparse there is evidence to suggest that particular vocalisations were for emotive terms. With this in mind, I think the Guardians' spoken language was used primarily for social bonding."
77,4,4,1,17,"This data regards the markings on the obelisks. These were the starting point for my research into the Guardians' language as explorers documented them, so it's fitting that I've come full circle and now have a better understanding of those markings. I've already established that the written form of the Guardians' language evolved from the sign language they developed during their pre-history as pack hunters."
78,4,4,6,18,"The data you've extracted from the delta patterns has granted me further insights - so much so that I'm confident I can establish a proper dictionary for future research. The limited understanding I've derived from their language reveals a fascinating species. Although the written glyphs share the shape and motion of the original sign language, they also evolved in response to new media, such as electronic representation. The glyphs on the obelisks and other structures provided the primary mechanism for recognising the patterns, and also gave me clues as to what the other data patterns might contain."
79,4,4,2,19,"The data contained in this obelisk talks about the history of the Guardians' language. They started to transcribe their signs in pictorial form very early in their development - something akin to the cave paintings from humanity's early history - although it's clear that even at an early stage their communication was more sophisticated than ours. This clearly speaks of a people with high intelligence and a keen desire to share information. Even though my research has barely begun, I believe we have much to learn from this magnificent people."
80,4,4,5,20,"This data contain information regarding the formal nature of their written communication and has reinforced what I've learnt about its use so far. As well as the obelisks, it was used for ceremonial and decorative purposes. I've also gained the impression that they found their glyphs aesthetically pleasing."
81,4,4,3,21,"As is always the case with research of this nature, finding answers tends to raise further questions. I've found references to another form of communication in this data packet, but not one used by the Guardians, or not all of them, at least. As far as I can tell it references some kind of foe or adversary. Combined with the devastation seen at a number of sites, it indicates the Guardians may not have been the cause of their own demise."
82,5,2,NULL,1,"This data stream is unlike the others. More complex with a lot more layers than the others. Intriguing, this data seems to be about the Guardians technology. This is very exciting, I was hoping we would find this kind of information. The epsilon-pattern data contains a lot of information about the Guardians' science and engineering, and extracting their historical records has helped isolate some of the specifics, adding to what we know about this fascinating species."
83,5,2,2,2,"As I have established from other data packages the guardians had the ability to manipulate genetics and active biology to achieve specific results, and it seems their healthcare revolved around this technology. As a species they were susceptible to maladies similar to those that affect us: they could get sick, develop cancers and suffer from parasites. They approached these issues from two different directions: they improved their immune systems to defend against infection, and engineered specific micro-organisms to tackle threats. If we can harness this type of technology we could effectively eradicate disease from our lives."
84,5,2,1,3,"This data will need further analysis from someone with a greater knowledge of medicine than I possess. It appears that the Guardians’ experimented with biological manipulation extending it to other creatures in their environment. These techniques were used not only to improve life for the other creatures, but also to address ecological issues, although the Guardians took great care to influence things only as much as was needed. There is a lot of data here that while I can generally understand needs a biologist to truly decipher all the information. After all I’m an engineer not a a(sic) doctor."
85,5,2,6,4,"This data details the social aspects of the Guardians Technology. Although obviously an intelligent species, it was the Guardians' social constructs that allowed them to progress so quickly. They were required to involve themselves in various socially progressive activities, from caring for the young to researching cutting-edge physics. This was facilitated by institutions, which made research data and education available to all. The development of implants and the monolith network created a kind of shared virtual workspace, and the direct brain interface allowed thoughts to be shared and manipulated. I wonder how much they could have achieved if religious strife hadn't brought about their destruction?"
86,5,2,4,5,"This data is incomplete by what we can decipher relates to the communication systems the Guardians used. As with human civilisation, communication systems were key to establishing a stable society. In many respects, the technology the Guardians used was the same as ours, in that they utilised various electro-magnetic wavelengths and physical optical mediums. I suspect their faster-than-light technology shared the same principles as our own, too, although I haven't extracted enough technical data to be certain"
87,5,2,5,6,"This data gives some more information about the monolith network - the imposing structures explorers have discovered at various Guardian sites - served as a foundation for all their communication systems. It's clear, however, that the monoliths had ceremonial significance as well as being functional, so I mustn't underestimate their importance"
88,5,2,NULL,7,"This is very interesting. According to the data package you just sent me they monolith network was used for most if not all communications regardless of importance. In keeping with their predilection for sharing knowledge, few restrictions were placed on the network. I thought there might have been separate networks for military and administrative use, but I haven't found any evidence of that. Everything points to an extremely open society, which would have made them even more vulnerable when significant social divisions arose."
89,5,2,2,8,"Now I understand. This was the missing piece. The monolith network was augmented by vehicle-based communication systems, personal devices and even implants. These were designed to operate seamlessly with the network to provide ad-hoc coverage. Having implants that you can direct communications to you directly would revolutionise communications as we know it. I can only speculate what this would have felt like, but it might have even gone as far as a technological telepathy of sorts."
90,5,2,1,9,"This data, while unremarkable at first glance has proven something that I long suspected to be true. The networks were content agnostic, and the full range of language forms was supported. I've even found extracts of virtual entertainment experiences that supported full audience participation"
91,5,2,6,10,"This data is only partially intact but I have been able to decode the following information. For a species that experienced only brief periods of war, the Guardians developed very sophisticated means of waging it, although their arsenal was nowhere near as varied as ours. In terms of flight and small-class spaceships, humanity has surpassed the Guardians, but in other respects their technology outmatched ours."
